symbol,company_name,last_price,net_change,percent_change,market_cap,country,ipo_year,volume,sector,industry,exchange
DOYU,DouYu International Holdings Limited ADS,$4.89,-0.06,-1.21%,147574621,China,2019,5155,Technology,Computer Software: Programming Data Processing,NASDAQ
DPRO,Draganfly Inc. Common Shares,$5.11,-0.2,-3.77%,175661212,Canada,,1150950,Industrials,Aerospace,NASDAQ
DPZ,Domino's Pizza Inc Common Stock,$330.42,-7.35,-2.18%,10990387085,United States,2004,1062805,Consumer Discretionary,Food Distributors,NASDAQ
DRCT,Direct Digital Holdings Inc. Class A Common Stock,$4.24,0.25,6.27%,3152177,United States,2022,293826,Consumer Discretionary,Advertising,NASDAQ
DRDB,Roman DBDR Acquisition Corp. II Ordinary shares,$10.51,-0.01,-0.10%,0,United States,2025,292960,,,NASDAQ
DRH,Diamondrock Hospitality Company Common Stock,$10.23,-0.24,-2.29%,2091938746,United States,2005,2409925,Real Estate,Real Estate Investment Trusts,NASDAQ
DRIO,DarioHealth Corp. Common Stock,$7.45,0.15,2.06%,54388025,Israel,,3940,Health Care,Medical/Dental Instruments,NASDAQ
DRMA,Dermata Therapeutics Inc. Common Stock,$1.30,-0.03,-2.26%,5228786,United States,2021,30444,Health Care,Biotechnology: Pharmaceutical Preparations,NASDAQ
DRMAW,Dermata Therapeutics Inc. Warrant,$0.0158,-0.0002,-1.25%,63550,United States,2021,2103,Health Care,Biotechnology: Pharmaceutical Preparations,NASDAQ
DRS,Leonardo DRS Inc. Common Stock,$40.00,-0.03,-0.08%,10639795440,Israel,,833559,Industrials,Industrial Machinery/Components,NASDAQ
DRTS,Alpha Tau Medical Ltd. Ordinary Shares,$7.53,-1.01,-11.83%,662713320,Israel,,1571754,Health Care,Medical/Dental Instruments,NASDAQ
DRTSW,Alpha Tau Medical Ltd. Warrant,$1.08,-0.25,-18.80%,95050516,Israel,,76157,Health Care,Medical/Dental Instruments,NASDAQ
DRUG,Bright Minds Biosciences Inc. Common Stock,$83.26,-3.7,-4.26%,814879025,Canada,,227283,Health Care,Biotechnology: Pharmaceutical Preparations,NASDAQ
DRVN,Driven Brands Holdings Inc. Common Stock,$13.65,-0.38,-2.71%,2244800076,United States,2021,1193482,Consumer Discretionary,Automotive Aftermarket,NASDAQ
DSAC,Daedalus Special Acquisition Corp. Class A Ordinary Shares,$9.95,-0.01,-0.10%,0,Cayman Islands,2026,31168,Finance,Blank Checks,NASDAQ
DSACU,Daedalus Special Acquisition Corp. Unit,$10.03,0,0.00%,0,Cayman Islands,2025,11,Finance,Blank Checks,NASDAQ
DSGN,Design Therapeutics Inc. Common Stock,$13.17,-0.13,-0.98%,822558348,United States,2021,414254,Health Care,Biotechnology: Pharmaceutical Preparations,NASDAQ
DSGR,Distribution Solutions Group Inc. Common Stock,$27.21,-0.33,-1.20%,1256970440,United States,,41906,Consumer Discretionary,Industrial Specialties,NASDAQ
DSGX,Descartes Systems Group Inc. (The) Common Stock,$73.72,0.59,0.81%,6341710880,Canada,,441956,Technology,Computer Software: Prepackaged Software,NASDAQ
DSP,Viant Technology Inc. Class A Common Stock,$11.52,0.14,1.23%,735325908,United States,2021,157818,Technology,Computer Software: Programming Data Processing,NASDAQ
DSWL,Deswell Industries Inc. Common Shares,$3.34,-0.06,-1.77%,53223698,Macau,1995,10493,Industrials,Plastic Products,NASDAQ
DSY,Big Tree Cloud Holdings Limited Class A Ordinary Shares,$2.176,0.026,1.21%,10340073,China,,3261,Consumer Discretionary,Containers/Packaging,NASDAQ
DSYWW,Big Tree Cloud Holdings Limited Warrants,$0.0195,-0.0011,-5.34%,92662,China,,38032,Consumer Discretionary,Containers/Packaging,NASDAQ
DTCX,Datacentrex Inc. Common Stock,$2.20,-0.025,-1.12%,79658487,United States,,177503,Technology,EDP Services,NASDAQ
DTI,Drilling Tools International Corporation Common Stock,$3.43,-0.06,-1.72%,120695732,United States,2021,307062,Consumer Discretionary,Oil and Gas Field Machinery,NASDAQ
DTIL,Precision BioSciences Inc. Common Stock,$7.63,0.35,4.81%,196878408,United States,2019,163619,Health Care,Biotechnology: Biological Products (No Diagnostic Substances),NASDAQ
DTSQ,DT Cloud Star Acquisition Corporation Ordinary Shares,$11.215,0,0.00%,0,United States,2024,862,,,NASDAQ
DTSQU,DT Cloud Star Acquisition Corporation Units,$10.9475,0,0.00%,0,United States,2024,117,,,NASDAQ
DTSS,Datasea Intelligent Technology Ltd. Class A Ordinary Shares,$0.9188,-0.0188,-2.01%,9598844,China,,67461,Technology,Computer Software: Prepackaged Software,NASDAQ
DTST,Data Storage Corporation Common Stock,$3.99,0.04,1.01%,8646881,United States,,8456,Technology,EDP Services,NASDAQ
DTSTW,Data Storage Corporation Warrant,$0.052,0.0123,30.98%,112691,United States,,152708,Technology,EDP Services,NASDAQ
DUO,Fangdd Network Group Ltd. Class A Ordinary Shares,$1.52,-0.03,-1.94%,5924670,China,2019,91213,Finance,Real Estate,NASDAQ
DUOL,Duolingo Inc. Class A Common Stock,$110.23,-1.02,-0.92%,5156782836,United States,2021,5045752,Technology,Computer Software: Prepackaged Software,NASDAQ
DUOT,Duos Technologies Group Inc. Common Stock,$9.08,0.05,0.55%,266004130,United States,,527917,Technology,Computer Software: Prepackaged Software,NASDAQ
DVLT,Datavault AI Inc. Common Stock,$0.56,-0.1838,-24.71%,391143128,United States,2018,237440869,Technology,Semiconductors,NASDAQ
DWSN,Dawson Geophysical Company Common Stock,$3.62,0.18,5.23%,112411281,United States,,148872,Energy,Oil & Gas Production,NASDAQ
DWTX,Dogwood Therapeutics Inc. Common Stock,$1.41,-0.05,-3.43%,47096190,United States,2020,76219,Health Care,Biotechnology: Pharmaceutical Preparations,NASDAQ
DXCM,DexCom Inc. Common Stock,$60.04,-1.31,-2.14%,23167813539,United States,2005,5493213,Health Care,Medical/Dental Instruments,NASDAQ
DXLG,Destination XL Group Inc. Common Stock,$0.6283,0.0073,1.18%,34437444,United States,,78067,Consumer Discretionary,Clothing/Shoe/Accessory Stores,NASDAQ
DXPE,DXP Enterprises Inc. Common Stock,$172.15,3.25,1.92%,2669239461,United States,,170862,Industrials,Industrial Machinery/Components,NASDAQ
DXR,Daxor Corporation Common Stock,$10.12,-0.32,-3.07%,50991037,United States,,4066,Health Care,Medical/Dental Instruments,NASDAQ
DXST,Decent Holding Inc Class A Ordinary Shares,$1.82,-0.15,-7.61%,3303487,China,2025,39853,Industrials,Miscellaneous,NASDAQ
DYAI,Dyadic International Inc. Common Stock,$0.751,-0.039,-4.94%,27365466,United States,,21997,Health Care,Biotechnology: Biological Products (No Diagnostic Substances),NASDAQ
DYN,Dyne Therapeutics Inc. Common Stock,$17.71,0.32,1.84%,2926037363,United States,2020,1512869,Health Care,Biotechnology: Pharmaceutical Preparations,NASDAQ
DYNC,Dynamix Corporation Class A Ordinary Shares,$10.73,-0.02,-0.19%,0,United States,2024,180409,,,NASDAQ
DYNCU,Dynamix Corporation Unit,$10.89,0,0.00%,0,United States,2024,9,,,NASDAQ
DYNCW,Dynamix Corporation Warrant,$0.15,-0.0062,-3.97%,0,United States,2024,33415,,,NASDAQ
DYOR,Insight Digital Partners II Class A Ordinary Shares,$10.01,0.01,0.10%,0,United States,2025,5304,Finance,Blank Checks,NASDAQ
DYORU,Insight Digital Partners II Units,$10.1101,0,0.00%,0,United States,2025,20,Finance,Blank Checks,NASDAQ
EA,Electronic Arts Inc. Common Stock,$201.82,-0.27,-0.13%,50506204358,United States,,1429703,Consumer Discretionary,Services-Misc. Amusement & Recreation,NASDAQ
EBAY,eBay Inc. Common Stock,$109.33,5.26,5.05%,48653072419,United States,1998,20481130,Real Estate,Real Estate,NASDAQ
EBC,Eastern Bankshares Inc. Common Stock,$19.92,-0.34,-1.68%,4658270964,United States,2020,1330485,Finance,Savings Institutions,NASDAQ
EBMT,Eagle Bancorp Montana Inc. Common Stock,$22.37,-0.24,-1.06%,178186691,United States,2010,56423,Finance,Major Banks,NASDAQ
EBON,Ebang International Holdings Inc. Class A Ordinary Shares,$2.405,-0.06,-2.43%,15738171,China,2020,2697,Technology,Semiconductors,NASDAQ
ECBK,ECB Bancorp Inc. Common Stock,$18.07,-0.02,-0.11%,158612623,United States,2022,11581,Finance,Banks,NASDAQ
ECOR,electroCore Inc. Common Stock,$6.68,0.04,0.60%,53998167,United States,2018,37906,Health Care,Biotechnology: Electromedical & Electrotherapeutic Apparatus,NASDAQ
ECPG,Encore Capital Group Inc Common Stock,$83.19,-0.11,-0.13%,1786245947,United States,,212206,Finance,Finance Companies,NASDAQ
ECX,ECARX Holdings Inc. Class A Ordinary shares,$1.12,0.02,1.82%,426787182,China,,673012,Technology,EDP Services,NASDAQ
ECXWW,ECARX Holdings Inc. Warrants,$0.05,-0.0049,-8.93%,19052999,China,,360,Technology,EDP Services,NASDAQ
EDAP,EDAP TMS S.A. American Depositary Shares,$3.34,-0.13,-3.75%,125189833,France,1997,54610,Health Care,Biotechnology: Electromedical & Electrotherapeutic Apparatus,NASDAQ
EDBL,Edible Garden AG Incorporated Common Stock,$0.451,-0.038,-7.77%,412104,United States,2022,1620704,Consumer Staples,Farming/Seeds/Milling,NASDAQ
EDBLW,Edible Garden AG Incorporated Warrant,$0.079,0,0.00%,72187,United States,2022,1408,Consumer Staples,Farming/Seeds/Milling,NASDAQ
EDHL,Everbright Digital Holding Limited Ordinary Shares,$2.335,-0.125,-5.08%,3890694,Hong Kong,2025,11070,Consumer Discretionary,Advertising,NASDAQ
EDIT,Editas Medicine Inc. Common Stock,$3.00,0.1,3.45%,293717814,United States,2016,980347,Health Care,Biotechnology: Biological Products (No Diagnostic Substances),NASDAQ
EDRY,EuroDry Ltd. Common Shares ,$19.51,-0.76,-3.75%,56394572,Greece,,14832,Consumer Discretionary,Marine Transportation,NASDAQ
EDSA,Edesa Biotech Inc. Common Shares,$16.11,-1.48,-8.41%,134488874,United States,,568326,Health Care,Biotechnology: Pharmaceutical Preparations,NASDAQ
EDTK,Skillful Craftsman Education Technology Limited Ordinary Share,$1.00,-0.01,-0.99%,15929451,China,2020,644,Real Estate,Other Consumer Services,NASDAQ
EDUC,Educational Development Corporation Common Stock,$1.46,0.05,3.55%,12426591,United States,,28985,Consumer Discretionary,Consumer Specialties,NASDAQ
EEFT,Euronet Worldwide Inc. Common Stock,$72.48,-1.53,-2.07%,2751783218,United States,1997,409213,Finance,Investment Bankers/Brokers/Service,NASDAQ
EEIQ,EpicQuest Education Group International Limited Common Stock,$3.26,-0.02,-0.61%,4823102,United States,2021,1345306,Real Estate,Other Consumer Services,NASDAQ
EFOI,Energy Focus Inc. Common Stock,$3.70,-0.19,-4.88%,23322702,United States,,114958,Consumer Discretionary,Building Products,NASDAQ
EFSC,Enterprise Financial Services Corporation Common Stock,$58.12,-0.77,-1.31%,2126366987,United States,,236236,Finance,Major Banks,NASDAQ
EFSCP,Enterprise Financial Services Corporation Depositary Shares Each Representing a 1/40th Interest in a Share of 5% Fixed Rate Non-Cumulative Perpetual Preferred Stock Series A,$20.21,0.36,1.81%,739399119,United States,,1429,Finance,Major Banks,NASDAQ
EFSI,Eagle Financial Services Inc Common Stock,$35.73,-1.92,-5.10%,193384194,United States,,16247,Finance,Major Banks,NASDAQ
EGAN,eGain Corporation Common Stock,$7.88,0.15,1.94%,215802547,United States,1999,187593,Technology,Computer Software: Prepackaged Software,NASDAQ
EGBN,Eagle Bancorp Inc. Common Stock,$25.70,-0.42,-1.61%,780340588,United States,,198017,Finance,Major Banks,NASDAQ
EH,EHang Holdings Limited ADS,$10.15,0,0.00%,730646309,China,2019,477872,Industrials,Aerospace,NASDAQ
EHGO,Eshallgo Inc. Class A Ordinary Shares,$2.0302,-0.1348,-6.23%,4106250,China,2024,2227,Consumer Discretionary,Diversified Commercial Services,NASDAQ
EHLD,Euroholdings Ltd. Common Stock ,$8.30,0.099,1.21%,23377905,Greece,,2457,Consumer Discretionary,Marine Transportation,NASDAQ
EHTH,eHealth Inc. Common Stock,$1.89,-0.15,-7.35%,59597226,United States,2006,253949,Finance,Specialty Insurers,NASDAQ
EIKN,Eikon Therapeutics Inc. Common Stock,$10.27,0.59,6.10%,556002960,United States,2026,216875,Health Care,Biotechnology: Biological Products (No Diagnostic Substances),NASDAQ
EJH,E-Home Household Service Holdings Limited Ordinary Shares,$1.57,-0.05,-3.09%,5024242,China,2021,17614,Consumer Discretionary,Other Consumer Services,NASDAQ
ELAB,PMGC Holdings Inc. Common Stock,$2.33,-0.18,-7.17%,9758226,United States,2023,343358,Health Care,Biotechnology: Pharmaceutical Preparations,NASDAQ
ELBM,Electra Battery Materials Corporation Common Stock,$0.6023,0.0153,2.61%,62481596,Canada,,9070782,Miscellaneous,Industrial Machinery/Components,NASDAQ
ELDN,Eledon Pharmaceuticals Inc. Common Stock,$3.78,0.09,2.44%,291769971,United States,2014,1006248,Health Care,Biotechnology: Pharmaceutical Preparations,NASDAQ
ELE,Elemental Royalty Corporation Common Stock,$17.09,0.25,1.49%,1097607984,Canada,,178641,Basic Materials,Precious Metals,NASDAQ
ELMT,The Elmet Group Co. Common Stock,$15.37,-0.28,-1.79%,447610888,United States,2026,509549,Industrials,Metal Fabrications,NASDAQ
ELOG,Eastern International Ltd. Ordinary Shares,$0.899,0.024,2.74%,10803283,China,2025,9881,Industrials,Integrated Freight & Logistics,NASDAQ
ELPW,Elong Power Holding Limited Class A Ordinary Shares,$7.33,2.91,65.84%,10462138,China,,37569096,Miscellaneous,Industrial Machinery/Components,NASDAQ
ELSE,Electro-Sensors Inc. Common Stock,$7.65,0.02,0.26%,27023036,United States,,8683,Industrials,Industrial Machinery/Components,NASDAQ
ELTK,Eltek Ltd. Ordinary Shares,$8.43,-0.4,-4.53%,56648142,Israel,1997,1549,Technology,Electrical Products,NASDAQ
ELTX,Elicio Therapeutics Inc. Common Stock,$10.77,0.02,0.19%,198125717,United States,2021,106117,Health Care,Biotechnology: Pharmaceutical Preparations,NASDAQ
ELUT,Elutia Inc. Class A Common Stock,$1.01,0,0.00%,44650318,United States,2020,428151,Health Care,Biotechnology: Biological Products (No Diagnostic Substances),NASDAQ
ELVA,Electrovaya Inc. Common Shares,$9.45,-0.05,-0.53%,453607683,Canada,,224751,,,NASDAQ
ELVN,Enliven Therapeutics Inc. Common Stock,$41.61,-0.09,-0.22%,2533618545,United States,2020,538822,Health Care,Biotechnology: Pharmaceutical Preparations,NASDAQ
ELVR,Elevra Lithium Limited American Depository Shares,$92.09,-4.47,-4.63%,1559790675,Australia,,86842,Industrials,Mining & Quarrying of Nonmetallic Minerals (No Fuels),NASDAQ
ELWT,Elauwit Connection Inc. Common Stock,$7.16,0.12,1.71%,47397739,United States,2025,33966,Consumer Discretionary,Telecommunications Equipment,NASDAQ
EMAT,Evolution Metals & Technologies Corp. Common Stock,$9.58,-0.12,-1.24%,0,United States,,133764,,,NASDAQ
EMBC,Embecta Corp. Common Stock,$9.25,0.02,0.22%,547783650,United States,,1107252,Health Care,Medical/Dental Instruments,NASDAQ
EMIS,Emmis Acquisition Corp. Class A Ordinary Shares,$10.12,0,0.00%,0,United States,2025,15,Health Care,Biotechnology: Pharmaceutical Preparations,NASDAQ
EMISR,Emmis Acquisition Corp. Rights,$0.1101,-0.0299,-21.36%,0,United States,2025,10000,,,NASDAQ
EML,Eastern Company (The) Common Stock,$22.13,0.06,0.27%,133585311,United States,,18144,Consumer Discretionary,Industrial Machinery/Components,NASDAQ
EMPD,Empery Digital Inc. Common stock,$4.91,0.02,0.41%,0,United States,2021,353445,,,NASDAQ
ENGN,enGene Therapeutics Inc. Common Stock,$7.61,0.36,4.97%,509789836,Canada,,388591,Health Care,Biotechnology: Biological Products (No Diagnostic Substances),NASDAQ
ENGNW,enGene Therapeutics Inc. Warrants,$2.14,0.2199,11.45%,143357457,Canada,,3955,Health Care,Biotechnology: Biological Products (No Diagnostic Substances),NASDAQ
ENGS,Energys Group Limited Ordinary Shares,$1.19,-0.02,-1.65%,37191565,United Kingdom,2025,73849,Industrials,Engineering & Construction,NASDAQ
ENLT,Enlight Renewable Energy Ltd. Ordinary Shares,$88.80,-2.55,-2.79%,12382632528,Israel,2023,172678,Utilities,Electric Utilities: Central,NASDAQ
ENLV,Enlivex Ltd. Ordinary Shares,$0.8522,0.0362,4.44%,205421723,Israel,2014,295799,Health Care,Biotechnology: Pharmaceutical Preparations,NASDAQ
ENPH,Enphase Energy Inc. Common Stock,$32.54,-1.31,-3.87%,4288714079,United States,2012,5523986,Technology,Semiconductors,NASDAQ
ENSC,Ensysce Biosciences Inc. Common Stock,$0.417,0.028,7.20%,3868851,United States,,312650,Health Care,Biotechnology: Pharmaceutical Preparations,NASDAQ
ENSG,The Ensign Group Inc. Common Stock,$182.03,-1.69,-0.92%,10638816162,United States,2007,448957,Health Care,Hospital/Nursing Management,NASDAQ
ENTA,Enanta Pharmaceuticals Inc. Common Stock,$14.54,0.19,1.32%,421941262,United States,2013,154799,Health Care,Biotechnology: Pharmaceutical Preparations,NASDAQ
ENTG,Entegris Inc. Common Stock,$138.96,-3.33,-2.34%,21191400000,United States,2000,2580350,Industrials,Plastic Products,NASDAQ
ENTX,Entera Bio Ltd. Ordinary Shares,$1.11,0.01,0.91%,51750685,Israel,2018,125312,Health Care,Biotechnology: Biological Products (No Diagnostic Substances),NASDAQ
ENVB,Enveric Biosciences Inc. Common Stock,$3.41,-0.58,-14.54%,6770674,United States,,398012,Health Care,Biotechnology: Pharmaceutical Preparations,NASDAQ
ENVX,Enovix Corporation Common Stock,$6.75,-0.02,-0.30%,1468208599,United States,2021,4408932,Miscellaneous,Industrial Machinery/Components,NASDAQ
EOLS,Evolus Inc. Common Stock,$5.58,0.25,4.69%,367469511,United States,2018,2107378,Health Care,Biotechnology: Pharmaceutical Preparations,NASDAQ
EOSE,Eos Energy Enterprises Inc. Class A Common Stock,$6.38,-0.07,-1.09%,2165748573,United States,,14950442,Miscellaneous,Industrial Machinery/Components,NASDAQ
EPOW,E-Power Inc. Class A Ordinary Shares,$0.775,0.0131,1.72%,20914886,China,2021,30323,Real Estate,Real Estate,NASDAQ
EPRX,Eupraxia Pharmaceuticals Inc. Common Stock,$7.42,-0.47,-5.96%,456353596,Canada,,196951,Health Care,Pharmaceuticals and Biotechnology,NASDAQ
EPSM,Epsium Enterprise Limited Class A Ordinary Shares,$1.35,-0.07,-4.93%,18141346,Macau,2025,18877,Consumer Staples,Beverages (Production/Distribution),NASDAQ
EPSN,Epsilon Energy Ltd. Common Share,$6.30,-0.01,-0.16%,190566287,United States,,165543,Energy,Oil & Gas Production,NASDAQ
EQ,Equillium Inc. Common Stock,$2.10,0.02,0.96%,132775768,United States,2018,216319,Health Care,Biotechnology: Pharmaceutical Preparations,NASDAQ
EQIX,Equinix Inc. Common Stock REIT,$1083.20,-1.83,-0.17%,1.0683E+11,United States,2000,485519,Real Estate,Real Estate Investment Trusts,NASDAQ
EQPT,EquipmentShare.com Inc Class A Common Stock,$18.40,-1.73,-8.59%,4642135945,United States,2026,2434215,Consumer Discretionary,Diversified Commercial Services,NASDAQ
ERAS,Erasca Inc. Common Stock,$10.14,0.11,1.10%,3153194946,United States,2021,5547607,Health Care,Biotechnology: Pharmaceutical Preparations,NASDAQ
ERIC,Ericsson American Depositary Shares,$11.63,-0.13,-1.11%,39208820678,Sweden,,7687077,Technology,Radio And Television Broadcasting And Communications Equipment,NASDAQ
ERIE,Erie Indemnity Company Class A Common Stock,$210.65,-4.31,-2.01%,9730262647,United States,,230172,Finance,Specialty Insurers,NASDAQ
ERII,Energy Recovery Inc. Common Stock,$11.00,-0.04,-0.36%,572020449,United States,2008,596708,Technology,Industrial Machinery/Components,NASDAQ
ERNA,Ernexa Therapeutics Inc. Common Stock,$3.7401,-0.0724,-1.90%,4361619,United States,,87990,Health Care,Biotechnology: Pharmaceutical Preparations,NASDAQ
ERNAW,Ernexa Therapeutics Inc. Warrants,$0.0382,0.0081,26.91%,44548,United States,,16258,,,NASDAQ
ESCA,Escalade Incorporated Common Stock,$19.91,1.7,9.34%,274858307,United States,,117567,Consumer Discretionary,Recreational Games/Products/Toys,NASDAQ
ESEA,Euroseas Ltd. Common Stock (Marshall Islands),$68.40,-2.17,-3.08%,482622260,Greece,,101769,Consumer Discretionary,Marine Transportation,NASDAQ
ESLA,Estrella Immunopharma Inc. Common Stock,$1.53,-0.1,-6.14%,65277799,United States,2021,19394,Health Care,Biotechnology: Biological Products (No Diagnostic Substances),NASDAQ
ESLAW,Estrella Immunopharma Inc. Warrant,$0.10,-0.0257,-20.45%,4266523,United States,2021,13324,Health Care,Biotechnology: Biological Products (No Diagnostic Substances),NASDAQ
ESLT,Elbit Systems Ltd. Ordinary Shares,$857.79,26.57,3.20%,39894897638,Israel,,91159,Industrials,Military/Government/Technical,NASDAQ
ESOA,Energy Services of America Corporation Common Stock,$17.15,0.31,1.84%,285702519,United States,,93709,Industrials,Water Sewer Pipeline Comm & Power Line Construction,NASDAQ
ESPR,Esperion Therapeutics Inc. Common Stock,$3.12,0.01,0.32%,803103213,United States,2013,34218286,Health Care,Biotechnology: Pharmaceutical Preparations,NASDAQ
ESQ,Esquire Financial Holdings Inc. Common Stock,$105.62,-1.39,-1.30%,912243531,United States,2017,101630,Finance,Commercial Banks,NASDAQ
ESTA,Establishment Labs Holdings Inc. Common Shares,$70.24,0.01,0.01%,2064003173,Costa Rica,2018,674459,Health Care,Industrial Specialties,NASDAQ
ETON,Eton Pharmaceuticals Inc. Common Stock,$30.16,1.26,4.36%,825171297,United States,2018,644842,Health Care,Biotechnology: Pharmaceutical Preparations,NASDAQ
ETOR,eToro Group Ltd. Class A Common Shares,$38.31,1.4,3.79%,3085730017,Israel,2025,1373674,Finance,Investment Bankers/Brokers/Service,NASDAQ
ETS,Elite Express Holding Inc. Class A Common Stock,$0.5867,0.019,3.35%,9807671,United States,2025,22243,Industrials,Trucking Freight/Courier Services,NASDAQ
EU,enCore Energy Corp. Common Shares,$1.86,-0.01,-0.54%,348284133,United States,,1764538,Basic Materials,Other Metals and Minerals,NASDAQ
EUDA,EUDA Health Holdings Limited Ordinary Shares,$17.09,1.81,11.85%,42628014,Singapore,2021,54827,Health Care,Medical/Nursing Services,NASDAQ
EUDAW,EUDA Health Holdings Limited Warrant,$0.0397,0.0065,19.58%,99025,Singapore,2021,41605,Health Care,Medical/Nursing Services,NASDAQ
EURK,Eureka Acquisition Corp Class A Ordinary Share,$11.36,0.08,0.71%,0,United States,2024,4009,,,NASDAQ
EVAX,Evaxion A/S American Depositary Share,$4.57,0.075,1.67%,38114783,Denmark,2021,29336,Health Care,Biotechnology: Biological Products (No Diagnostic Substances),NASDAQ
EVCM,EverCommerce Inc. Common Stock,$11.64,-0.47,-3.88%,2060515896,United States,2021,107563,Technology,Computer Software: Prepackaged Software,NASDAQ
EVER,EverQuote Inc. Class A Common Stock,$14.61,0.12,0.83%,516803592,United States,2018,2008839,Technology,Computer Software: Programming Data Processing,NASDAQ
EVGN,Evogene Ltd Ordinary Shares,$0.752,-0.014,-1.83%,7440111,Israel,,43095,Industrials,Agricultural Chemicals,NASDAQ
EVGO,EVgo Inc. Class A Common Stock,$2.17,0,0.00%,680468596,United States,,4426705,Technology,EDP Services,NASDAQ
EVGOW,EVgo Inc. Warrants,$0.014,0.0017,13.82%,4390120,United States,,375915,Technology,EDP Services,NASDAQ
EVLV,Evolv Technologies Holdings Inc. Class A Common Stock,$7.14,-0.15,-2.06%,1280598720,United States,2020,2268795,Technology,Computer peripheral equipment,NASDAQ
EVLVW,Evolv Technologies Holdings Inc. Warrant,$0.1393,-0.0104,-6.95%,24984230,United States,2020,4468,Technology,Computer peripheral equipment,NASDAQ
EVO,Evotec SE American Depositary Shares,$3.12,0.03,0.97%,276722226,Germany,2021,75253,Health Care,Biotechnology: Pharmaceutical Preparations,NASDAQ
EVOX,Evolution Global Acquisition Corp Class A Ordinary Shares,$10.00,0,0.00%,0,United States,2025,50039,Finance,Blank Checks,NASDAQ
EVOXU,Evolution Global Acquisition Corp Units,$10.1885,-0.0015,-0.02%,0,United States,2025,1005,Finance,Blank Checks,NASDAQ
EVOXW,Evolution Global Acquisition Corp Warrants,$0.37,-0.0199,-5.10%,0,United States,2025,2368,Finance,Blank Checks,NASDAQ
EVRG,Evergy Inc. Common Stock,$82.08,-0.53,-0.64%,18901722950,United States,,1232903,Utilities,Power Generation,NASDAQ
EVTV,Envirotech Vehicles Inc. Common Stock,$1.72,-0.06,-3.37%,22240837,United States,,100204,Consumer Discretionary,Auto Parts:O.E.M.,NASDAQ
EWBC,East West Bancorp Inc. Common Stock,$123.42,-1.6,-1.28%,16905915103,United States,,586933,Finance,Major Banks,NASDAQ
EWCZ,European Wax Center Inc. Class A Common Stock,$5.81,0,0.00%,316860412,United States,2021,1026463,Consumer Discretionary,Other Consumer Services,NASDAQ
EWTX,Edgewise Therapeutics Inc. Common Stock,$31.45,0.84,2.74%,3380293867,United States,2021,682163,Health Care,Biotechnology: Pharmaceutical Preparations,NASDAQ
EXC,Exelon Corporation Common Stock,$46.61,0.11,0.24%,47690190992,United States,,6900692,Utilities,Power Generation,NASDAQ
EXE,Expand Energy Corporation Common Stock,$100.77,0.65,0.65%,24107091114,United States,,2393741,Energy,Oil & Gas Production,NASDAQ
EXEL,Exelixis Inc. Common Stock,$44.17,0.49,1.12%,11219541046,United States,2000,3145146,Health Care,Biotechnology: Biological Products (No Diagnostic Substances),NASDAQ
EXFY,Expensify Inc. Class A Common Stock,$1.12,0,0.00%,113145048,United States,2021,352895,Technology,Computer Software: Prepackaged Software,NASDAQ
EXLS,ExlService Holdings Inc. Common Stock,$31.72,-0.02,-0.06%,4846274571,United States,2006,2467135,Real Estate,Real Estate,NASDAQ
EXOZ,eXoZymes Inc. Common Stock,$9.92,0.17,1.74%,84012381,United States,2024,996,Health Care,Biotechnology: Biological Products (No Diagnostic Substances),NASDAQ
EXPE,Expedia Group Inc. Common Stock,$246.50,-5.34,-2.12%,29585441981,United States,,986879,Consumer Discretionary,Transportation Services,NASDAQ
EXPI,eXp World Holdings Inc. Common Stock,$6.25,-0.19,-2.95%,1011831850,United States,,981688,Finance,Real Estate,NASDAQ
EXPO,Exponent Inc. Common Stock,$64.96,-0.32,-0.49%,3158010392,United States,,588885,Consumer Discretionary,Professional Services,NASDAQ
EXTR,Extreme Networks Inc. Common Stock,$22.84,0.55,2.47%,2986971530,United States,1999,3339437,Telecommunications,Computer Communications Equipment,NASDAQ
EYE,National Vision Holdings Inc. Common Stock,$21.91,-1.63,-6.92%,1740468723,United States,2017,1876230,Health Care,Ophthalmic Goods,NASDAQ
EYPT,EyePoint Inc. Common Stock,$13.85,0.51,3.82%,1160563562,United States,,1062802,Industrials,Biotechnology: Laboratory Analytical Instruments,NASDAQ
EZGO,EZGO Technologies Ltd. Ordinary Shares,$1.23,-0.33,-21.15%,25688236,China,2021,1546021,Consumer Discretionary,Motor Vehicles,NASDAQ
EZPW,EZCORP Inc. Class A Non Voting Common Stock,$32.61,0.25,0.77%,2011946475,United States,1991,432922,Consumer Discretionary,Other Specialty Stores,NASDAQ
EZRA,Reliance Global Group Inc. Common Stock,$0.1785,0.0085,5.00%,3793663,United States,,4781739,Finance,Specialty Insurers,NASDAQ
FA,First Advantage Corporation Common Stock,$12.66,-0.31,-2.39%,2182674418,United States,2021,547348,Technology,EDP Services,NASDAQ
FABC,Fabric.AI Inc. Common Stock,$2.94,0.2,7.30%,4280567,United States,,986054,Consumer Discretionary,Telecommunications Equipment,NASDAQ
