symbol,company_name,last_price,net_change,percent_change,market_cap,country,ipo_year,volume,sector,industry,exchange
KLAC,KLA Corporation Common Stock,$1713.32,-12.94,-0.75%,2.23807E+11,United States,1980,791948,Technology,Electronic Components,NASDAQ
KLIC,Kulicke and Soffa Industries Inc. Common Stock,$87.85,1.52,1.76%,4596884431,Singapore,,633285,Technology,Semiconductors,NASDAQ
KLRA,Kailera Therapeutics Inc. Common Stock,$25.09,-0.06,-0.24%,3084784715,United States,2026,730077,Health Care,Biotechnology: Pharmaceutical Preparations,NASDAQ
KLRS,Kalaris Therapeutics Inc. Common Stock,$5.53,0.07,1.28%,127147369,United States,2020,54815,Health Care,Biotechnology: Biological Products (No Diagnostic Substances),NASDAQ
KLTR,Kaltura Inc. Common Stock,$1.42,-0.04,-2.74%,213532134,United States,2021,403033,Technology,Computer Software: Prepackaged Software,NASDAQ
KLXE,KLX Energy Services Holdings Inc. Common Stock,$4.03,0.31,8.33%,79265071,United States,,226554,Energy,Oilfield Services/Equipment,NASDAQ
KMB,Kimberly-Clark Corporation Common Stock,$95.65,-2.02,-2.07%,31750095147,United States,,4366811,Consumer Discretionary,Containers/Packaging,NASDAQ
KMDA,Kamada Ltd. Ordinary Shares,$8.29,0.08,0.97%,478217404,Israel,2013,42803,Health Care,Biotechnology: Pharmaceutical Preparations,NASDAQ
KMRK,K-Tech Solutions Company Limited Class A Ordinary Shares,$2.80,0.54,23.89%,59080000,Hong Kong,2025,30087,Consumer Discretionary,Recreational Games/Products/Toys,NASDAQ
KMTS,Kestra Medical Technologies Ltd. Common Stock,$20.55,-1.27,-5.82%,1199572404,United States,2025,329396,Health Care,Medical/Dental Instruments,NASDAQ
KNDI,Kandi Technologies Group Inc. Ordinary Shares,$0.76,0.025,3.40%,76315677,China,,144290,Industrials,Auto Manufacturing,NASDAQ
KNSA,Kiniksa Pharmaceuticals International plc Class A Ordinary Shares,$57.62,2.35,4.25%,4433168482,United States,2018,763853,Health Care,Biotechnology: Pharmaceutical Preparations,NASDAQ
KOD,Kodiak Sciences Inc Common Stock,$42.26,-1.7,-3.87%,2626699248,United States,2018,892287,Health Care,Biotechnology: Biological Products (No Diagnostic Substances),NASDAQ
KOPN,Kopin Corporation Common Stock,$4.47,0.17,3.95%,820139356,United States,1992,15337230,Technology,Semiconductors,NASDAQ
KOSS,Koss Corporation Common Stock,$4.22,-0.14,-3.21%,39948368,United States,,33429,Consumer Staples,Consumer Electronics/Appliances,NASDAQ
KOYN,CSLM Digital Asset Acquisition Corp III Class A Ordinary Shares,$10.11,0.01,0.10%,0,United States,2025,330,,,NASDAQ
KPLT,Katapult Holdings Inc. Common Stock,$6.81,-0.41,-5.68%,32450045,United States,2019,21008,Consumer Discretionary,Diversified Commercial Services,NASDAQ
KPLTW,Katapult Holdings Inc. Warrant,$0.0015,-0.0004,-21.05%,7148,United States,2019,96965,Consumer Discretionary,Diversified Commercial Services,NASDAQ
KPRX,Kiora Pharmaceuticals Inc.  Common Stock,$2.54,0.1,4.10%,11258398,United States,,59575,Health Care,Biotechnology: Pharmaceutical Preparations,NASDAQ
KPTI,Karyopharm Therapeutics Inc. Common Stock,$9.30,0.53,6.04%,209652839,United States,2013,325306,Health Care,Biotechnology: Pharmaceutical Preparations,NASDAQ
KRAQ,KRAKacquisition Corp Class A Ordinary Shares,$9.88,-0.03,-0.30%,0,United States,2026,37762,,,NASDAQ
KRAQU,KRAKacquisition Corp Unit,$10.04,0.02,0.20%,0,United States,2026,3596,,,NASDAQ
KRKR,36Kr Holdings Inc. American Depositary Shares,$3.46,0.07,2.07%,136587662,China,2019,20044,Real Estate,Real Estate,NASDAQ
KRMD,KORU Medical Systems Inc. Common Stock (DE),$3.99,-0.08,-1.97%,185586870,United States,,82985,Health Care,Medical/Dental Instruments,NASDAQ
KRNT,Kornit Digital Ltd. Ordinary Shares,$16.11,0.17,1.07%,746545084,Israel,2015,153515,Industrials,Industrial Machinery/Components,NASDAQ
KRNY,Kearny Financial Corp Common Stock,$7.97,-0.16,-1.97%,515971033,United States,2005,328814,Finance,Savings Institutions,NASDAQ
KROS,Keros Therapeutics Inc. Common Stock,$11.71,0.22,1.92%,231715571,United States,2020,393492,Health Care,Biotechnology: Pharmaceutical Preparations,NASDAQ
KRRO,Korro Bio Inc. Common Stock,$13.03,-0.54,-3.98%,187926100,United States,2019,50049,Health Care,Biotechnology: Pharmaceutical Preparations,NASDAQ
KRT,Karat Packaging Inc. Common Stock,$28.93,-0.04,-0.14%,577550738,United States,2021,61160,Industrials,Plastic Products,NASDAQ
KRUS,Kura Sushi USA Inc. Class A Common Stock,$54.03,-2.08,-3.71%,656350064,United States,2019,191563,Consumer Discretionary,Restaurants,NASDAQ
KRYS,Krystal Biotech Inc. Common Stock,$286.95,20.91,7.86%,8446587315,United States,2017,657965,Health Care,Biotechnology: Biological Products (No Diagnostic Substances),NASDAQ
KSCP,Knightscope Inc. Class A Common Stock,$3.31,0.18,5.75%,53896442,United States,2022,725919,Telecommunications,Telecommunications Equipment,NASDAQ
KSPI,Joint Stock Company Kaspi.kz American Depository Shares,$85.41,-1.01,-1.17%,16170971246,Kazakhstan,2024,366094,,,NASDAQ
KTCC,Key Tronic Corporation Common Stock,$2.91,-0.02,-0.68%,31600473,United States,1983,1870,Technology,Electrical Products,NASDAQ
KTOS,Kratos Defense & Security Solutions Inc. Common Stock,$61.93,-0.12,-0.19%,11607151042,United States,,3116159,Industrials,Military/Government/Technical,NASDAQ
KTTA,Pasithea Therapeutics Corp. Common Stock,$0.8466,0.0056,0.67%,21114160,United States,2021,602417,Health Care,Biotechnology: Pharmaceutical Preparations,NASDAQ
KTWO,K2 Capital Acquisition Corporation Class A Ordinary Share,$9.93,0,0.00%,199008719,Cayman Islands,2026,256555,,,NASDAQ
KURA,Kura Oncology Inc. Common Stock,$9.25,0.48,5.47%,821055012,United States,,1307392,Health Care,Biotechnology: Pharmaceutical Preparations,NASDAQ
KUST,Kustom Entertainment Inc. Common Stock,$3.38,0.02,0.60%,1779952,United States,,53228,Technology,Radio And Television Broadcasting And Communications Equipment,NASDAQ
KVAC,Keen Vision Acquisition Corporation Ordinary Shares,$12.06,0,0.00%,0,United States,2023,22,,,NASDAQ
KVACW,Keen Vision Acquisition Corporation Warrant,$0.0161,-0.0014,-8.00%,0,United States,2023,38740,,,NASDAQ
KVHI,KVH Industries Inc. Common Stock,$9.55,0.31,3.36%,186171635,United States,1996,121409,Technology,Radio And Television Broadcasting And Communications Equipment,NASDAQ
KWM,K Wave Media Ltd. Ordinary Shares,$0.3071,-0.1062,-25.70%,22493181,Cayman Islands,,10204629,Consumer Discretionary,Movies/Entertainment,NASDAQ
KWMWW,K Wave Media Ltd. Warrant,$0.0398,-0.0002,-0.50%,2915105,Cayman Islands,,350,Consumer Discretionary,Movies/Entertainment,NASDAQ
KXIN,Kaixin Holdings Ordinary Shares,$4.74,0.2126,4.70%,7838837,China,2017,24759,Consumer Discretionary,Retail-Auto Dealers and Gas Stations,NASDAQ
KYIV,Kyivstar Group Ltd. Common Shares,$12.39,0.1,0.81%,2860400301,United Arab Emirates,,790758,Telecommunications,Telecommunications Equipment,NASDAQ
KYIVW,Kyivstar Group Ltd. Warrant,$4.91,0.2,4.25%,1133540394,United Arab Emirates,,2918,Telecommunications,Telecommunications Equipment,NASDAQ
KYMR,Kymera Therapeutics Inc. Common Stock,$83.59,2.88,3.57%,6875911781,United States,2020,507797,Health Care,Biotechnology: Biological Products (No Diagnostic Substances),NASDAQ
KYNB,Kyntra Bio Inc. Common Stock,$7.20,0.11,1.55%,29146406,United States,2014,8956,Health Care,Biotechnology: Pharmaceutical Preparations,NASDAQ
KYTX,Kyverna Therapeutics Inc. Common Stock,$9.00,0.13,1.47%,544772637,United States,2024,894264,Health Care,Biotechnology: Biological Products (No Diagnostic Substances),NASDAQ
KZIA,Kazia Therapeutics Limited American Depositary Shares,$12.84,-0.55,-4.11%,146721383,Australia,,260635,Health Care,Biotechnology: Pharmaceutical Preparations,NASDAQ
KZR,Kezar Life Sciences Inc. Common Stock,$7.39,0.06,0.82%,54475585,United States,2018,91672,Health Care,Biotechnology: Pharmaceutical Preparations,NASDAQ
LAB,Standard BioTools Inc. Common Stock,$0.935,-0.0005,-0.05%,364994191,United States,2011,2202608,Industrials,Biotechnology: Laboratory Analytical Instruments,NASDAQ
LABT,Lakewood-Amedex Biotherapeutics Inc. Common Stock,$3.26,-0.17,-4.96%,46684393,United States,,820622,Health Care,Biotechnology: Pharmaceutical Preparations,NASDAQ
LAES,SEALSQ Corp Ordinary Shares,$2.97,0.1,3.48%,661638777,Switzerland,,15457696,Technology,Semiconductors,NASDAQ
LAFA,LaFayette Acquisition Corp. Ordinary Share,$10.04,0.025,0.25%,0,France,2025,38963,,,NASDAQ
LAKE,Lakeland Industries Inc. Common Stock,$9.48,-0.02,-0.21%,101655983,United States,1986,63464,Health Care,Industrial Specialties,NASDAQ
LAMR,Lamar Advertising Company Class A Common Stock,$139.53,-0.82,-0.58%,14154138216,United States,1996,722618,Real Estate,Real Estate Investment Trusts,NASDAQ
LAND,Gladstone Land Corporation Common Stock,$9.59,-0.19,-1.94%,410802735,United States,2013,601439,Real Estate,Real Estate Investment Trusts,NASDAQ
LANDO,Gladstone Land Corporation 6.00% Series B Cumulative Redeemable Preferred Stock,$21.20,0.11,0.52%,908135348,United States,,4525,Real Estate,Real Estate Investment Trusts,NASDAQ
LANDP,Gladstone Land Corporation 6.00% Series C Cumulative Redeemable Preferred Stock,$20.70,0.01,0.05%,886717061,United States,,17835,Real Estate,Real Estate Investment Trusts,NASDAQ
LARK,Landmark Bancorp Inc. Common Stock,$26.08,-0.51,-1.92%,159044290,United States,,8528,Finance,Major Banks,NASDAQ
LASE,Laser Photonics Corporation Common Stock,$0.7184,0.0003,0.04%,27707440,United States,2022,1469157,Miscellaneous,Industrial Machinery/Components,NASDAQ
LASR,nLIGHT Inc. Common Stock,$69.41,-1.57,-2.21%,3915172319,United States,2018,770536,Technology,Semiconductors,NASDAQ
LATA,Galata Acquisition Corp. II Class A Ordinary Shares,$10.04,0,0.00%,0,United States,2025,20,Finance,Blank Checks,NASDAQ
LAUR,Laureate Education Inc. Common Stock,$31.57,0.33,1.06%,4419114584,United States,2017,1742341,Real Estate,Other Consumer Services,NASDAQ
LBGJ,Li Bang International Corporation Inc. Class A Ordinary Shares,$0.7704,-0.0346,-4.30%,1068915,China,2024,44223,Industrials,Industrial Machinery/Components,NASDAQ
LBRDA,Liberty Broadband Corporation Class A Common Stock,$38.57,-1.42,-3.55%,5534707446,United States,,194988,Telecommunications,Cable & Other Pay Television Services,NASDAQ
LBRDK,Liberty Broadband Corporation Class C Common Stock,$38.63,-1.47,-3.67%,5543317310,United States,,1471658,Telecommunications,Cable & Other Pay Television Services,NASDAQ
LBRDP,Liberty Broadband Corporation Series A Cumulative Redeemable Preferred Stock,$21.81,-0.09,-0.41%,3129685491,United States,,20827,Telecommunications,Cable & Other Pay Television Services,NASDAQ
LBRX,LB Pharmaceuticals Inc Common Stock,$31.83,0.4,1.27%,912745526,United States,2025,123521,Health Care,Biotechnology: Pharmaceutical Preparations,NASDAQ
LBTYA,Liberty Global Ltd. Class A Common Shares,$11.81,-0.15,-1.25%,3992919653,United Kingdom,,2405772,Telecommunications,Cable & Other Pay Television Services,NASDAQ
LBTYB,Liberty Global Ltd. Class B Common Shares,$16.40,-0.09,-0.55%,5544782584,United Kingdom,,5678,Telecommunications,Cable & Other Pay Television Services,NASDAQ
LBTYK,Liberty Global Ltd. Class C Common Shares,$11.51,-0.26,-2.21%,3891490703,United Kingdom,,1157950,Telecommunications,Cable & Other Pay Television Services,NASDAQ
LCCC,Lakeshore Acquisition III Corp. Ordinary Shares,$10.34,0,0.00%,0,United States,2025,236,Finance,Blank Checks,NASDAQ
LCFY,Locafy Limited Ordinary Share,$4.34,-0.1,-2.25%,7807899,Australia,2022,11142,Technology,Computer Software: Programming Data Processing,NASDAQ
LCFYW,Locafy Limited Warrant,$2.69,0,0.00%,4839458,Australia,2022,12,Technology,Computer Software: Programming Data Processing,NASDAQ
LCID,Lucid Group Inc. Common Stock,$6.69,0.15,2.29%,2208667876,United States,,19080360,Industrials,Auto Manufacturing,NASDAQ
LCNB,LCNB Corporation Common Stock,$15.86,-0.44,-2.70%,225814141,United States,,33302,Finance,Major Banks,NASDAQ
LCUT,Lifetime Brands Inc. Common Stock,$5.95,-0.76,-11.33%,135987298,United States,1991,133682,Consumer Discretionary,Industrial Machinery/Components,NASDAQ
LE,Lands' End Inc. Common Stock,$10.83,-0.57,-5.00%,332263209,United States,,195240,Consumer Discretionary,Clothing/Shoe/Accessory Stores,NASDAQ
LECO,Lincoln Electric Holdings Inc. Common Shares,$262.06,-4.19,-1.57%,14357510047,United States,,417656,Industrials,Industrial Machinery/Components,NASDAQ
LEDS,SemiLEDS Corporation Common Stock,$1.71,-0.09,-5.00%,14120587,Taiwan,2010,106446,Technology,Semiconductors,NASDAQ
LEE,Lee Enterprises Incorporated Common Stock,$8.24,-0.08,-0.96%,183174697,United States,,55894,Consumer Discretionary,Newspapers/Magazines,NASDAQ
LEGH,Legacy Housing Corporation Common Stock (TX),$20.51,-1.11,-5.13%,488391114,United States,2018,74987,Consumer Discretionary,Homebuilding,NASDAQ
LEGN,Legend Biotech Corporation American Depositary Shares,$26.50,2.91,12.34%,4901324672,United States,2020,3888203,Health Care,Biotechnology: Pharmaceutical Preparations,NASDAQ
LENZ,LENZ Therapeutics Inc. Common Stock,$9.28,0.4,4.51%,290968776,United States,2021,1192288,Health Care,Biotechnology: Biological Products (No Diagnostic Substances),NASDAQ
LESL,Leslie's Inc. Common Stock,$1.56,-0.15,-8.77%,14533857,United States,2020,119922,Consumer Discretionary,Other Specialty Stores,NASDAQ
LEXX,Lexaria Bioscience Corp. Common Stock,$0.6715,-0.0398,-5.60%,16644770,Canada,,61779,Health Care,Biotechnology: Pharmaceutical Preparations,NASDAQ
LFAC,Leapfrog Acquisition Corporation Class A Ordinary Shares,$9.99,0,0.00%,0,United States,2026,20,Finance,Blank Checks,NASDAQ
LFCR,Lifecore Biomedical Inc. Common Stock,$5.13,-0.13,-2.47%,192258990,United States,,163730,Health Care,Biotechnology: Pharmaceutical Preparations,NASDAQ
LFMD,LifeMD Inc. Common Stock,$5.09,0.09,1.80%,242282305,United States,,939581,Health Care,Medical/Nursing Services,NASDAQ
LFMDP,LifeMD Inc. 8.875% Series A Cumulative Perpetual Preferred Stock,$23.75,0.1,0.42%,1130492091,United States,,961,Health Care,Medical/Nursing Services,NASDAQ
LFS,LEIFRAS Co. Ltd. American Depositary Shares  ,$2.02,-0.01,-0.49%,52844450,Japan,2025,19112,Consumer Discretionary,Other Consumer Services,NASDAQ
LFST,LifeStance Health Group Inc. Common Stock,$7.27,-0.26,-3.45%,2819507212,United States,2021,3373325,Health Care,Medical/Nursing Services,NASDAQ
LFUS,Littelfuse Inc. Common Stock,$424.27,17.19,4.22%,10675529683,United States,,484935,Energy,Electrical Products,NASDAQ
LFVN,Lifevantage Corporation Common Stock (Delaware),$5.13,-0.3,-5.53%,65629932,United States,,204481,Health Care,Biotechnology: Pharmaceutical Preparations,NASDAQ
LFWD,Lifeward Ltd. Ordinary Shares,$7.075,-0.17,-2.35%,19658489,Israel,2014,5258,Health Care,Industrial Specialties,NASDAQ
LGCB,Linkage Global Inc. Class A Ordinary Shares,$0.5613,0.0113,2.06%,6265524,Japan,2023,50694,Consumer Discretionary,Catalog/Specialty Distribution,NASDAQ
LGCL,Lucas GC Limited Ordinary Shares,$1.81,0.06,3.43%,77450631,China,2024,3292,Technology,Computer Software: Programming Data Processing,NASDAQ
LGHL,Lion Group Holding Ltd. American Depositary Share,$0.8282,0.0372,4.70%,3864727,China,,94748,Finance,Investment Bankers/Brokers/Service,NASDAQ
LGIH,LGI Homes Inc. Common Stock,$44.88,-3.65,-7.52%,1042664682,United States,2013,495676,Consumer Discretionary,Homebuilding,NASDAQ
LGN,Legence Corp. Class A Common stock,$91.41,1.315,1.46%,9875747364,United States,2025,1351978,Consumer Discretionary,Engineering & Construction,NASDAQ
LGND,Ligand Pharmaceuticals Incorporated Common Stock,$228.36,0.92,0.41%,4575953952,United States,,221237,Health Care,Biotechnology: Pharmaceutical Preparations,NASDAQ
LGO,Largo Inc. Common Shares,$1.15,0,0.00%,96225100,Canada,,589017,Industrials,Mining & Quarrying of Nonmetallic Minerals (No Fuels),NASDAQ
LGVN,Longeveron Inc. Class A Common Stock,$0.8628,0.0118,1.39%,20075418,United States,2021,263850,Health Care,Biotechnology: Pharmaceutical Preparations,NASDAQ
LHAI,Linkhome Holdings Inc. Common stock,$1.20,0.1,9.09%,19476000,United States,2025,280582,Finance,Real Estate,NASDAQ
LHSW,Lianhe Sowell International Group Ltd Class A Ordinary Shares,$0.231,-0.0261,-10.15%,12012000,China,2025,427710,Technology,Computer Software: Prepackaged Software,NASDAQ
LI,Li Auto Inc. American Depositary Shares,$17.88,0.31,1.76%,19100408394,China,2020,1943036,Industrials,Auto Manufacturing,NASDAQ
LICN,Lichen International Limited Class A Ordinary Shares,$4.27,-0.33,-7.17%,70185243,China,2023,17048,Consumer Discretionary,Professional Services,NASDAQ
LIDR,AEye Inc. Class A Common Stock,$1.95,-0.09,-4.41%,88424542,United States,2021,1380587,Consumer Discretionary,Auto Parts:O.E.M.,NASDAQ
LIDRW,AEye Inc. Warrant,$0.0461,-0.0037,-7.43%,2090447,United States,2021,21789,Consumer Discretionary,Auto Parts:O.E.M.,NASDAQ
LIEN,Chicago Atlantic BDC Inc. Common Stock,$9.33,0.08,0.87%,212919519,United States,2022,24667,Finance,Finance: Consumer Services,NASDAQ
LIF,Life360 Inc. Common Stock,$46.28,0.53,1.16%,3734246332,United States,2024,542853,Technology,EDP Services,NASDAQ
LIFE,Ethos Technologies Inc. Class A Common Stock,$19.49,0.84,4.50%,1225329537,United States,2026,701472,Finance,Specialty Insurers,NASDAQ
LILA,Liberty Latin America Ltd. Class A Common Stock,$7.89,-0.36,-4.36%,1594111640,United States,,345629,Telecommunications,Cable & Other Pay Television Services,NASDAQ
LILAK,Liberty Latin America Ltd. Class C Common Stock,$8.05,-0.4,-4.73%,1626438366,United States,,722564,Telecommunications,Cable & Other Pay Television Services,NASDAQ
LIMN,Liminatus Pharma Inc. Class A Common Stock,$0.2131,0.0079,3.85%,9563424,United States,,567655,,,NASDAQ
LIMNW,Liminatus Pharma Inc. Warrants,$0.06,0,0.00%,0,United States,,25,,,NASDAQ
LIN,Linde plc Ordinary Shares,$493.55,-14.37,-2.83%,2.28316E+11,United States,,2406599,Basic Materials,Major Chemicals,NASDAQ
LINC,Lincoln Educational Services Corporation Common Stock,$41.06,0.13,0.32%,1301461657,United States,2005,304420,Real Estate,Other Consumer Services,NASDAQ
LIND,Lindblad Expeditions Holdings Inc. Common Stock,$17.84,-0.71,-3.83%,1168514898,United States,2013,792455,Consumer Discretionary,Transportation Services,NASDAQ
LINE,Lineage Inc. Common Stock,$35.29,-1.75,-4.73%,8015786410,United States,2024,758563,Real Estate,Real Estate Investment Trusts,NASDAQ
LINK,Interlink Electronics Inc. Common Stock,$2.98,-0.16,-5.10%,46935021,United States,,22623,Technology,Computer peripheral equipment,NASDAQ
LIQT,LiqTech International Inc. Common Stock,$2.03,-0.18,-8.15%,20194117,Denmark,,2373,Technology,Industrial Machinery/Components,NASDAQ
LITE,Lumentum Holdings Inc. Common Stock,$976.18,26.25,2.76%,69699252000,United States,,5445784,Telecommunications,Telecommunications Equipment,NASDAQ
LITS,Lite Strategy Inc. Common Stock,$1.14,0.01,0.89%,41452679,United States,2003,151685,Health Care,Biotechnology: Pharmaceutical Preparations,NASDAQ
LIVE,Live Ventures Incorporated Common Stock,$12.70,-0.46,-3.50%,39010031,United States,,2267,Consumer Discretionary,Other Specialty Stores,NASDAQ
LIVN,LivaNova PLC Ordinary Shares,$59.07,-1.93,-3.16%,3244507292,United Kingdom,,737697,Health Care,Biotechnology: Electromedical & Electrotherapeutic Apparatus,NASDAQ
LIXT,Lixte Biotechnology Holdings Inc. Common Stock,$3.29,-0.08,-2.37%,38223036,United States,,7028,Health Care,Biotechnology: Pharmaceutical Preparations,NASDAQ
LKFN,Lakeland Financial Corporation Common Stock,$60.71,-0.67,-1.09%,1512503806,United States,,160494,Finance,Major Banks,NASDAQ
LKQ,LKQ Corporation Common Stock,$27.75,-0.76,-2.67%,7070445671,United States,2003,4137223,Consumer Discretionary,Motor Vehicles,NASDAQ
LKSP,Lake Superior Acquisition Corp. Class A Ordinary Shares,$10.10,0.01,0.10%,0,United States,2025,3647,,,NASDAQ
LLYVA,Liberty Live Holdings Inc. Series A Liberty Live Group Common Stock,$92.03,-0.47,-0.51%,8460471498,United States,,196778,Consumer Discretionary,Services-Misc. Amusement & Recreation,NASDAQ
LLYVK,Liberty Live Holdings Inc. Series C Liberty Live Group Common Stock,$94.10,-0.565,-0.60%,8650770053,United States,,210627,Consumer Discretionary,Services-Misc. Amusement & Recreation,NASDAQ
LMAT,LeMaitre Vascular Inc. Common Stock,$111.53,-0.51,-0.46%,2548214911,United States,2006,236934,Health Care,Medical/Dental Instruments,NASDAQ
LMB,Limbach Holdings Inc. Common Stock,$102.29,3.12,3.15%,1219405943,United States,,224157,Consumer Discretionary,Engineering & Construction,NASDAQ
LMFA,LM Funding America Inc. Common Stock,$0.2436,0.0011,0.45%,3950407,United States,2015,318501,Finance,Finance: Consumer Services,NASDAQ
LMNR,Limoneira Co Common Stock,$12.79,0.03,0.24%,231586957,United States,,86247,Consumer Staples,Farming/Seeds/Milling,NASDAQ
LMRI,Lumexa Imaging Holdings Inc. Common Stock,$10.19,0.19,1.90%,979361297,United States,2025,360566,Health Care,Medical Specialities,NASDAQ
LNAI,Lunai Bioworks Inc. Common Stock,$0.3246,0.0047,1.47%,11773605,United States,,100392878,Health Care,Biotechnology: Pharmaceutical Preparations,NASDAQ
LNKS,Linkers Industries Limited Class A Ordinary Shares,$1.64,0.06,3.80%,2634845,Malaysia,2024,117146,Technology,Electrical Products,NASDAQ
LNSR,LENSAR Inc. Common Stock,$5.56,-0.05,-0.89%,67251708,United States,,48498,Health Care,Medical/Dental Instruments,NASDAQ
LNT,Alliant Energy Corporation Common Stock,$73.68,-0.38,-0.51%,19029852086,United States,,3435475,Utilities,Power Generation,NASDAQ
LNTH,Lantheus Holdings Inc. Common Stock,$87.78,2.28,2.67%,5703207399,United States,2015,1012316,Health Care,Biotechnology: In Vitro & In Vivo Diagnostic Substances,NASDAQ
LNZA,LanzaTech Global Inc. Common Stock,$22.97,-1.81,-7.30%,231748074,United States,2021,16258,Industrials,Major Chemicals,NASDAQ
LNZAW,LanzaTech Global Inc. Warrant,$0.0164,0,0.00%,165462,United States,2021,8900,Industrials,Major Chemicals,NASDAQ
LOAN,Manhattan Bridge Capital Inc,$4.33,-0.02,-0.46%,49489090,United States,,36091,Real Estate,Real Estate Investment Trusts,NASDAQ
LOBO,LOBO TECHNOLOGIES LTD. Class A Ordinary Shares,$0.639,-0.0048,-0.75%,8844998,China,2024,309986,Consumer Discretionary,Motor Vehicles,NASDAQ
LOCO,El Pollo Loco Holdings Inc. Common Stock,$13.00,-0.07,-0.54%,390744731,United States,2014,340173,Consumer Discretionary,Restaurants,NASDAQ
LOGI,Logitech International S.A. Ordinary Shares,$101.50,2.01,2.02%,14878778019,United States,1997,2749078,Technology,Computer peripheral equipment,NASDAQ
LOKV,Live Oak Acquisition Corp. V Class A Ordinary Shares,$10.46,0,0.00%,0,United States,2025,209450,,,NASDAQ
LOKVW,Live Oak Acquisition Corp. V Warrants,$1.51,0.06,4.14%,0,United States,2025,70118,,,NASDAQ
LONA,LeonaBio Inc. Common Stock,$9.55,0.73,8.28%,89708059,United States,2020,25163,Health Care,Biotechnology: Biological Products (No Diagnostic Substances),NASDAQ
LOOP,Loop Industries Inc. Common Stock,$1.37,-0.01,-0.73%,66222450,Canada,,56572,Industrials,Major Chemicals,NASDAQ
LOPE,Grand Canyon Education Inc. Common Stock,$166.32,2.91,1.78%,4409857711,United States,2008,410903,Real Estate,Other Consumer Services,NASDAQ
LOT,Lotus Technology Inc. American Depositary Shares,$1.23,-0.07,-5.39%,789770546,China,,115505,Industrials,Auto Manufacturing,NASDAQ
LOTWW,Lotus Technology Inc. Warrants,$0.058,-0.0119,-17.02%,37241213,China,,6215,Industrials,Auto Manufacturing,NASDAQ
LOVE,The Lovesac Company Common Stock,$15.42,-0.34,-2.16%,227906058,United States,2018,128893,Consumer Discretionary,Other Specialty Stores,NASDAQ
LPAA,Launch One Acquisition Corp. Class A Ordinary shares,$10.74,-0.01,-0.09%,0,United States,2024,13194,,,NASDAQ
LPAAW,Launch One Acquisition Corp. Warrant,$0.12,-0.01,-7.69%,0,United States,2024,48135,Finance,Blank Checks,NASDAQ
LPBB,Launch Two Acquisition Corp. Class A Ordinary Shares,$10.64,0,0.00%,0,United States,2024,200925,,,NASDAQ
LPBBU,Launch Two Acquisition Corp. Unit,$10.64,0,0.00%,0,United States,2024,80,Finance,Blank Checks,NASDAQ
LPBBW,Launch Two Acquisition Corp. Warrant,$0.17,0.0001,0.06%,0,United States,2024,3646,,,NASDAQ
LPCN,Lipocine Inc. Common Stock,$2.29,-0.04,-1.72%,17118013,United States,,69219,Health Care,Biotechnology: Pharmaceutical Preparations,NASDAQ
LPCV,Launchpad Cadenza Acquisition Corp I Class A Ordinary Share,$9.99,0,0.00%,0,United States,2026,10,,,NASDAQ
LPCVW,Launchpad Cadenza Acquisition Corp I Warrant,$0.2701,0.0101,3.89%,0,United States,2026,453,,,NASDAQ
LPLA,LPL Financial Holdings Inc. Common Stock,$320.85,2.22,0.70%,25728345468,United States,2010,965519,Finance,Investment Bankers/Brokers/Service,NASDAQ
LPRO,Open Lending Corporation Common Stock,$1.77,0,0.00%,209244235,United States,,813192,Finance,Finance: Consumer Services,NASDAQ
LPSN,LivePerson Inc. Common Stock,$2.65,-0.03,-1.12%,31942048,United States,2000,92970,Technology,Computer Software: Prepackaged Software,NASDAQ
LPTH,LightPath Technologies Inc. Class A Common Stock,$12.33,-1.37,-10.00%,711547075,United States,1996,3198568,Technology,Semiconductors,NASDAQ
LQDA,Liquidia Corporation Common Stock,$38.48,0.34,0.89%,3420626536,United States,2018,796982,Health Care,Biotechnology: Pharmaceutical Preparations,NASDAQ
LQDT,Liquidity Services Inc. Common Stock,$35.82,-0.09,-0.25%,1110917217,United States,2006,169833,Real Estate,Real Estate,NASDAQ
LRCX,Lam Research Corporation Common Stock,$258.57,1.85,0.72%,3.2336E+11,United States,1984,6497390,Technology,Industrial Machinery/Components,NASDAQ
LRE,Lead Real Estate Co. Ltd American Depositary Shares,$1.295,-0.005,-0.39%,17666261,Japan,2023,4410,Consumer Discretionary,Homebuilding,NASDAQ
LRHC,La Rosa Holdings Corp. Common Stock,$1.85,-0.04,-2.12%,98975,United States,2023,265284,Finance,Real Estate,NASDAQ
LRMR,Larimar Therapeutics Inc. Common Stock,$4.22,0.28,7.11%,438385994,United States,2014,2144105,Health Care,Biotechnology: Pharmaceutical Preparations,NASDAQ
LSAK,Lesaka Technologies Inc. Common Stock,$4.86,0.05,1.04%,407854481,South Africa,,27532,Finance,Investment Bankers/Brokers/Service,NASDAQ
LSBK,Lake Shore Bancorp Inc. Common Stock,$15.885,-0.0097,-0.06%,124909918,United States,2006,874,Finance,Savings Institutions,NASDAQ
