symbol,company_name,last_price,net_change,percent_change,market_cap,country,ipo_year,volume,sector,industry,exchange
PROK,ProKidney Corp. Class A Ordinary Shares,$1.88,-0.05,-2.59%,567696751,United States,2021,518279,Health Care,Biotechnology: Biological Products (No Diagnostic Substances),NASDAQ
PROP,Prairie Operating Co. Common Stock,$1.20,-0.06,-4.76%,116813218,United States,,2302778,Finance,Finance: Consumer Services,NASDAQ
PROV,Provident Financial Holdings Inc. Common Stock,$17.10,-0.05,-0.29%,109012842,United States,,2905,Finance,Savings Institutions,NASDAQ
PRPL,Purple Innovation Inc. Common Stock,$0.4743,-0.0251,-5.03%,51693335,United States,2015,436765,Consumer Discretionary,Home Furnishings,NASDAQ
PRPO,Precipio Inc.  Common Stock,$29.70,-1.24,-4.01%,53009451,United States,,27844,Industrials,Biotechnology: Laboratory Analytical Instruments,NASDAQ
PRQR,ProQR Therapeutics N.V. Ordinary Shares,$1.64,0.09,5.81%,172792145,Netherlands,2014,634679,Health Care,Biotechnology: Pharmaceutical Preparations,NASDAQ
PRSO,Peraso Inc. Common Stock,$0.981,-0.029,-2.87%,12374226,United States,,2142414,Technology,Semiconductors,NASDAQ
PRTA,Prothena Corporation plc Ordinary Shares,$10.79,0.15,1.41%,580857876,United States,,592375,Health Care,Biotechnology: Pharmaceutical Preparations,NASDAQ
PRTC,PureTech Health plc American Depositary Shares,$17.03,-1.11,-6.12%,411587920,United States,,34456,Health Care,Biotechnology: Pharmaceutical Preparations,NASDAQ
PRTH,Priority Technology Holdings Inc. Common Stock,$5.30,-0.03,-0.56%,436494337,United States,2016,123975,Real Estate,Real Estate,NASDAQ
PRTS,CarParts.com Inc. Common Stock,$0.9411,-0.0044,-0.47%,66340144,United States,2007,243457,Consumer Discretionary,Auto & Home Supply Stores,NASDAQ
PRVA,Privia Health Group Inc. Common Stock,$24.24,-0.61,-2.46%,3045149539,United States,2021,879160,Health Care,Medical/Nursing Services,NASDAQ
PRZO,ParaZero Technologies Ltd. Ordinary Shares,$0.7383,0.0088,1.21%,17296085,Israel,2023,381029,Industrials,Military/Government/Technical,NASDAQ
PSEC,Prospect Capital Corporation Common Stock,$2.72,-0.09,-3.20%,1323239050,United States,2004,4410807,Finance,Finance: Consumer Services,NASDAQ
PSHG,Performance Shipping Inc. Common Shares,$1.82,-0.04,-2.15%,22626528,Greece,,73642,Consumer Discretionary,Marine Transportation,NASDAQ
PSIG,PS International Group Ltd. Ordinary Shares,$6.30,0.03,0.48%,96872404,Hong Kong,,62945,Industrials,Integrated Freight & Logistics,NASDAQ
PSIX,Power Solutions International Inc. Common Stock,$67.78,-2.72,-3.86%,1562359501,United States,,487916,Industrials,Industrial Machinery/Components,NASDAQ
PSKY,Paramount Skydance Corporation Class B Common Stock,$11.13,0.04,0.36%,12373678543,United States,,12353787,Industrials,Broadcasting,NASDAQ
PSMT,PriceSmart Inc. Common Stock,$153.11,-5.1,-3.22%,4730468034,United States,,233763,Consumer Discretionary,Department/Specialty Retail Stores,NASDAQ
PSNL,Personalis Inc. Common Stock,$5.90,0.12,2.08%,617599610,United States,2019,1715484,Health Care,Medical Specialities,NASDAQ
PSNY,Polestar Automotive Holding UK PLC Class A ADS,$19.15,0.69,3.74%,2790059212,Sweden,,54459,Industrials,Auto Manufacturing,NASDAQ
PSNYW,Polestar Automotive Holding UK PLC Class C-1 ADS (ADW),$2.93,-0.27,-8.44%,426886344,Sweden,,10984,Industrials,Auto Manufacturing,NASDAQ
PSTV,PLUS THERAPEUTICS Inc. Common Stock ,$6.30,0.21,3.45%,43230776,United States,,136317,Health Care,Medical/Dental Instruments,NASDAQ
PTC,PTC Inc. Common Stock,$138.19,1.66,1.22%,16444073270,United States,,1213369,Technology,Computer Software: Prepackaged Software,NASDAQ
PTCT,PTC Therapeutics Inc. Common Stock,$65.49,0.34,0.52%,5429892669,United States,2013,1216028,Health Care,Biotechnology: Pharmaceutical Preparations,NASDAQ
PTEN,Patterson-UTI Energy Inc. Common Stock,$12.29,0.3,2.50%,4665500955,United States,1993,7016356,Energy,Oil & Gas Production,NASDAQ
PTGX,Protagonist Therapeutics Inc. Common Stock,$99.52,1.15,1.17%,6399652011,United States,2016,457463,Health Care,Biotechnology: Pharmaceutical Preparations,NASDAQ
PTLE,PTL LTD Class A Ordinary Shares,$5.90,0.1,1.72%,37058620,Singapore,2024,1648,Energy,Oil Refining/Marketing,NASDAQ
PTLO,Portillo's Inc. Class A Common Stock,$5.72,-0.77,-11.86%,432343689,United States,2021,2295902,Consumer Discretionary,Restaurants,NASDAQ
PTON,Peloton Interactive Inc. Class A Common Stock,$5.14,-0.22,-4.10%,2187013923,United States,2019,14633714,Consumer Discretionary,Recreational Games/Products/Toys,NASDAQ
PTOR,Praetorian Acquisition Corp. Class A Ordinary Shares,$9.84,0,0.00%,0,United States,2026,28199,Finance,Blank Checks,NASDAQ
PTORU,Praetorian Acquisition Corp. Units,$9.94,0,0.00%,0,United States,2026,105,,,NASDAQ
PTORW,Praetorian Acquisition Corp. Warrant,$0.29,-0.0001,-0.03%,0,United States,2026,900,Finance,Blank Checks,NASDAQ
PTRN,Pattern Group Inc. Series A Common Stock,$13.62,-0.17,-1.23%,2407558790,United States,2025,458136,Consumer Discretionary,Catalog/Specialty Distribution,NASDAQ
PUBM,PubMatic Inc. Class A Common Stock,$10.25,0.02,0.20%,478411852,United States,2020,483568,Technology,Computer Software: Programming Data Processing,NASDAQ
PULM,Pulmatrix Inc. Common Stock,$1.31,0.02,1.55%,4784493,United States,2014,19654,Health Care,Biotechnology: Pharmaceutical Preparations,NASDAQ
PURR,Hyperliquid Strategies Inc Common Stock,$6.38,0.11,1.75%,790912701,United States,,8053820,Finance,Finance: Consumer Services,NASDAQ
PVLA,Palvella Therapeutics Inc. Common Stock,$127.61,0.77,0.61%,1827845570,United States,,131831,Health Care,Biotechnology: Pharmaceutical Preparations,NASDAQ
PWP,Perella Weinberg Partners Class A Common Stock,$19.35,-1.26,-6.11%,1798282053,United States,2020,1952630,Finance,Finance: Consumer Services,NASDAQ
PXLW,Pixelworks Inc.  Common Stock,$5.69,-0.12,-2.07%,36195558,United States,2000,31438,Technology,Semiconductors,NASDAQ
PXS,Pyxis Tankers Inc. Common Stock,$4.63,0.12,2.66%,47573894,Greece,,65990,Consumer Discretionary,Marine Transportation,NASDAQ
PYPD,PolyPid Ltd. Ordinary Shares,$4.48,0.04,0.90%,85492897,Israel,2020,32626,Health Care,Biotechnology: Pharmaceutical Preparations,NASDAQ
PYPL,PayPal Holdings Inc. Common Stock,$50.39,-0.05,-0.10%,46392286271,United States,,13649473,Industrials,Diversified Commercial Services,NASDAQ
PYXS,Pyxis Oncology Inc. Common Stock,$1.76,0.04,2.33%,110625617,United States,2021,173547,Health Care,Biotechnology: Pharmaceutical Preparations,NASDAQ
PZZA,Papa John's International Inc. Common Stock,$34.54,-0.96,-2.70%,1136058283,United States,1993,965883,Consumer Discretionary,Restaurants,NASDAQ
QADRU,QDRO Acquisition Corp. Units,$9.98,0.055,0.55%,0,United States,2026,119,Finance,Blank Checks,NASDAQ
QCLS,Q/C Technologies Inc. Common Stock,$3.79,0.06,1.61%,29764496,United States,2014,165452,Health Care,Biotechnology: In Vitro & In Vivo Diagnostic Substances,NASDAQ
QCOM,QUALCOMM Incorporated Common Stock,$168.38,-8.63,-4.88%,1.77473E+11,United States,1991,23117426,Technology,Radio And Television Broadcasting And Communications Equipment,NASDAQ
QCRH,QCR Holdings Inc. Common Stock,$89.58,-1.29,-1.42%,1499864993,United States,,100260,Finance,Major Banks,NASDAQ
QDEL,QuidelOrtho Corporation Common Stock,$12.42,-0.22,-1.74%,845745551,United States,,1783472,Health Care,Biotechnology: In Vitro & In Vivo Diagnostic Substances,NASDAQ
QETA,Quetta Acquisition Corporation Common Stock,$11.50,0,0.00%,0,United States,2023,48,Finance,Blank Checks,NASDAQ
QETAR,Quetta Acquisition Corporation Right,$1.18,0,0.00%,0,United States,2023,10,Finance,Blank Checks,NASDAQ
QETAU,Quetta Acquisition Corporation Unit,$12.00,0,0.00%,0,United States,2023,1,Finance,Blank Checks,NASDAQ
QFIN,Qfin Holdings Inc. American Depositary Shares,$13.38,-0.01,-0.08%,1629040208,China,2018,779245,Finance,Finance: Consumer Services,NASDAQ
QLYS,Qualys Inc. Common Stock,$92.49,3.96,4.47%,3263967383,United States,2012,966203,Technology,Computer Software: Prepackaged Software,NASDAQ
QMCO,Quantum Corporation Common Stock,$7.56,0.04,0.53%,110663499,United States,,342293,Technology,Electronic Components,NASDAQ
QNCX,Quince Therapeutics Inc. Common Stock,$1.22,-0.11,-8.27%,19886969,United States,2019,955170,Health Care,Biotechnology: Biological Products (No Diagnostic Substances),NASDAQ
QNRX,Quoin Pharmaceuticals Ltd. American Depositary Shares,$6.36,0.15,2.42%,11471068,Israel,2016,6097,Health Care,Medical/Dental Instruments,NASDAQ
QNST,QuinStreet Inc. Common Stock,$12.74,-0.3,-2.30%,726102783,United States,2010,735270,Real Estate,Real Estate,NASDAQ
QNTM,Quantum Biopharma Ltd. Class B Subordinate Voting Shares,$5.20,-0.35,-6.31%,30312178,Canada,,128733,Health Care,Biotechnology: Pharmaceutical Preparations,NASDAQ
QQQX,Nuveen NASDAQ 100 Dynamic Overwrite Fund Shares of Beneficial Interest,$30.13,-0.08,-0.27%,0,United States,,87664,Finance,Finance Companies,NASDAQ
QRHC,Quest Resource Holding Corporation Common Stock,$1.12,-0.015,-1.32%,23474921,United States,,20737,Utilities,Environmental Services,NASDAQ
QRVO,Qorvo Inc. Common Stock,$92.53,-0.97,-1.04%,8578056478,United States,,923123,Technology,Semiconductors,NASDAQ
QS,QuantumScape Corporation Class A Common Stock,$7.19,-0.07,-0.96%,4422893096,United States,,10662984,Miscellaneous,Industrial Machinery/Components,NASDAQ
QSEA,Quartzsea Acquisition Corporation Ordinary Shares,$10.41,0.01,0.10%,0,United States,2025,1651,Finance,Blank Checks,NASDAQ
QSI,Quantum-Si Incorporated Class A Common Stock,$0.9715,0.0133,1.39%,210202263,United States,2020,2873560,Industrials,Industrial Machinery/Components,NASDAQ
QSIAW,Quantum-Si Incorporated Warrant,$0.07,0.0002,0.29%,15145814,United States,2020,14364,Industrials,Industrial Machinery/Components,NASDAQ
QTI,QT Imaging Holdings Inc. Common Stock,$6.53,-0.09,-1.36%,78637525,United States,,31060,Health Care,Biotechnology: Electromedical & Electrotherapeutic Apparatus,NASDAQ
QTRX,Quanterix Corporation Common Stock,$3.37,-0.03,-0.88%,158609010,United States,2017,456585,Industrials,Biotechnology: Laboratory Analytical Instruments,NASDAQ
QTTB,Q32 Bio Inc. Common Stock,$5.04,0,0.00%,78772494,United States,2018,178375,Health Care,Biotechnology: Pharmaceutical Preparations,NASDAQ
QUBT,Quantum Computing Inc. Common Stock,$9.50,0.29,3.15%,2142460302,United States,,13368408,Technology,Computer Software: Prepackaged Software,NASDAQ
QUCY,Quantum Cyber N.V. Ordinary Shares,$0.40,-0.0106,-2.58%,5006134,Germany,2021,354477,Health Care,Biotechnology: Pharmaceutical Preparations,NASDAQ
QUIK,QuickLogic Corporation Common Stock,$18.31,1.99,12.19%,324461165,United States,1999,1099727,Technology,Semiconductors,NASDAQ
QUMS,Quantumsphere Acquisition Corp. Ordinary Shares,$10.16,0,0.00%,0,United States,2025,155,,,NASDAQ
QURE,uniQure N.V. Ordinary Shares,$20.68,1.55,8.10%,1303527589,Netherlands,2014,1891259,Health Care,Biotechnology: Pharmaceutical Preparations,NASDAQ
QXL,Quantum X Labs Inc. Common Stock,$3.12,0.12,4.00%,41609543,Israel,,40519,Technology,Computer Software: Prepackaged Software,NASDAQ
RAAQ,Real Asset Acquisition Corp. Class A Ordinary Share,$10.865,-0.025,-0.23%,0,United States,2025,111744,Finance,Blank Checks,NASDAQ
RAAQU,Real Asset Acquisition Corp. Unit,$12.60,0,0.00%,0,United States,2025,97,Finance,Blank Checks,NASDAQ
RAAQW,Real Asset Acquisition Corp. Warrants,$2.35,-0.1,-4.08%,0,United States,2025,56753,Finance,Blank Checks,NASDAQ
RADX,Radiopharm Theranostics Limited American Depositary Shares,$4.50,0.09,2.04%,57393243,Australia,,16079,Health Care,Biotechnology: Pharmaceutical Preparations,NASDAQ
RAIL,FreightCar America Inc. Common Stock,$8.06,-0.24,-2.89%,153640969,United States,2005,202085,Industrials,Railroads,NASDAQ
RAIN,Rain Enhancement Technologies Holdco Inc. Class A Common Stock,$2.10,-0.07,-3.23%,17196549,United States,,4890,Technology,Industrial Machinery/Components,NASDAQ
RAINW,Rain Enhancement Technologies Holdco Inc. Warrants,$0.2275,0,0.00%,1862960,United States,,1,Technology,Industrial Machinery/Components,NASDAQ
RAND,Rand Capital Corporation Common Stock,$10.80,-0.28,-2.53%,32073991,United States,,5852,Finance,Finance: Consumer Services,NASDAQ
RANG,Range Capital Acquisition Corp. Ordinary Shares,$10.58,0,0.00%,0,United States,2025,14529,Finance,Blank Checks,NASDAQ
RANGR,Range Capital Acquisition Corp. Rights,$0.30,0.005,1.70%,0,United States,2025,200,Finance,Blank Checks,NASDAQ
RANGU,Range Capital Acquisition Corp. Units,$10.82,0,0.00%,0,United States,2024,10,Finance,Blank Checks,NASDAQ
RANI,Rani Therapeutics Holdings Inc. Class A Common Stock,$0.9322,-0.0078,-0.83%,115305949,United States,2021,495739,Health Care,Biotechnology: Pharmaceutical Preparations,NASDAQ
RAPP,Rapport Therapeutics Inc. Common Stock,$35.53,1.64,4.84%,1698604845,United States,2024,333694,Health Care,Biotechnology: Pharmaceutical Preparations,NASDAQ
RARE,Ultragenyx Pharmaceutical Inc. Common Stock,$24.81,0.04,0.16%,2439006941,United States,2014,1849298,Health Care,Biotechnology: Pharmaceutical Preparations,NASDAQ
RAVE,Rave Restaurant Group Inc. Common Stock,$2.79,0.04,1.46%,39650269,United States,,26672,Consumer Discretionary,Food Distributors,NASDAQ
RAY,Raytech Holding Limited Ordinary Shares,$2.57,0.07,2.80%,7002942,Hong Kong,2024,14334,Consumer Discretionary,Consumer Electronics/Appliances,NASDAQ
RAYA,Erayak Power Solution Group Inc. Class A Ordinary Shares,$4.12,0.42,11.35%,4048184,China,2022,179211,Consumer Discretionary,Metal Fabrications,NASDAQ
RBB,RBB Bancorp Common Stock,$23.89,-0.35,-1.44%,407901659,United States,2017,125246,Finance,Major Banks,NASDAQ
RBBN,Ribbon Communications Inc. Common Stock,$2.67,-0.08,-2.91%,468605369,United States,,649081,Technology,EDP Services,NASDAQ
RBCAA,Republic Bancorp Inc. Class A Common Stock,$75.81,-0.47,-0.62%,1486584444,United States,1998,74652,Finance,Major Banks,NASDAQ
RBKB,Rhinebeck Bancorp Inc. Common Stock,$16.09,-0.21,-1.29%,179451336,United States,2019,9389,Finance,Banks,NASDAQ
RBNE,Robin Energy Ltd. Common Stock,$1.63,0.01,0.62%,4523030,Cyprus,,324911,Consumer Discretionary,Marine Transportation,NASDAQ
RCAT,Red Cat Holdings Inc. Common Stock,$11.00,-0.23,-2.05%,1342562925,United States,,6405373,Technology,Computer Software: Prepackaged Software,NASDAQ
RCEL,Avita Medical Inc. Common Stock,$4.28,-0.16,-3.60%,131724229,United States,,235097,Health Care,Medical/Dental Instruments,NASDAQ
RCKT,Rocket Pharmaceuticals Inc. Common Stock,$3.61,0.05,1.40%,393933442,United States,2015,1198697,Health Care,Biotechnology: Pharmaceutical Preparations,NASDAQ
RCKTW,Rocket Pharmaceuticals Inc. Warrant,$0.0099,-0.0001,-1.00%,1080316,United States,,2120,Health Care,Biotechnology: Pharmaceutical Preparations,NASDAQ
RCKY,Rocky Brands Inc. Common Stock,$36.29,-1.11,-2.97%,273654289,United States,1993,101928,Consumer Discretionary,Shoe Manufacturing,NASDAQ
RCMT,RCM Technologies Inc. Common Stock,$31.16,-0.1,-0.32%,218879587,United States,,105748,Consumer Discretionary,Professional Services,NASDAQ
RCON,Recon Technology Ltd. Class A Ordinary Shares,$0.9065,0.0065,0.72%,27763762,China,2009,1774,Energy,Oilfield Services/Equipment,NASDAQ
RCT,RedCloud Holdings plc Ordinary Shares,$0.6809,-0.0241,-3.42%,37666266,United Kingdom,2025,182777,Technology,Computer Software: Programming Data Processing,NASDAQ
RDAC,Rising Dragon Acquisition Corp. Ordinary Shares,$8.01,-1.28,-13.78%,0,China,2024,342603,,,NASDAQ
RDACR,Rising Dragon Acquisition Corp. Rights,$0.165,0.0224,15.71%,0,China,2024,28905,Finance,Blank Checks,NASDAQ
RDACU,Rising Dragon Acquisition Corp. Unit,$9.86,-2.46,-19.97%,0,China,2024,2351,Finance,Blank Checks,NASDAQ
RDAG,Republic Digital Acquisition Company Class A Ordinary Shares,$10.25,0,0.00%,0,United States,2025,17171,Finance,Blank Checks,NASDAQ
RDAGW,Republic Digital Acquisition Company Warrants,$0.4999,0.0499,11.09%,0,United States,2025,6810,Finance,Blank Checks,NASDAQ
RDCM,Radcom Ltd. Ordinary Shares,$15.90,-0.16,-1.00%,265378266,Israel,1997,155506,Technology,Computer peripheral equipment,NASDAQ
RDGT,Ridgetech Inc. Ordinary Shares,$1.50,0.11,7.91%,1348359,China,,163795,Consumer Staples,Retail-Drug Stores and Proprietary Stores,NASDAQ
RDHL,Redhill Biopharma Ltd. American Depositary Shares,$1.04,-0.045,-4.15%,5398910,Israel,,41311,Health Care,Biotechnology: Pharmaceutical Preparations,NASDAQ
RDI,Reading International Inc Class A Common Stock,$1.10,0,0.00%,24988986,United States,,28465,Consumer Discretionary,Movies/Entertainment,NASDAQ
RDIB,Reading International Inc Class B Common Stock,$9.45,0.15,1.61%,214678107,United States,,740,Consumer Discretionary,Movies/Entertainment,NASDAQ
RDNT,RadNet Inc. Common Stock,$58.26,1.41,2.48%,4575492678,United States,,887866,Health Care,Medical Specialities,NASDAQ
RDNW,RideNow Group Inc. Class B Common Stock,$6.99,-0.25,-3.45%,269461592,United States,,41243,Technology,EDP Services,NASDAQ
RDVT,Red Violet Inc. Common Stock ,$40.20,0.55,1.39%,567318118,United States,,93130,Technology,Computer Software: Prepackaged Software,NASDAQ
RDWR,Radware Ltd. Ordinary Shares,$27.23,0.505,1.89%,1152018793,Israel,1999,180232,Real Estate,Real Estate,NASDAQ
RDZN,Roadzen Inc. Ordinary Shares,$1.95,-0.27,-12.16%,155406560,United States,2022,2259276,Finance,Specialty Insurers,NASDAQ
RDZNW,Roadzen Inc. Warrants,$0.2625,0.0304,13.10%,20920114,United States,2022,45385,Finance,Specialty Insurers,NASDAQ
REAL,The RealReal Inc. Common Stock,$12.85,1.08,9.18%,1547947610,United States,2019,6865736,Consumer Discretionary,Other Specialty Stores,NASDAQ
REAX,The Real Brokerage Inc. Common Shares,$2.07,-0.06,-2.82%,441941272,Canada,,3436134,Finance,Real Estate,NASDAQ
REBN,Reborn Coffee Inc. Common Stock,$2.44,-0.14,-5.43%,20040830,United States,2022,43987,Consumer Discretionary,Restaurants,NASDAQ
RECT,Rectitude Holdings Ltd Ordinary Shares,$1.28,-0.01,-0.78%,18560000,Singapore,2024,22074,Consumer Discretionary,Industrial Machinery/Components,NASDAQ
REE,REE Automotive Ltd. Class A Ordinary Shares,$0.4889,-0.0661,-11.91%,15166134,Israel,,151243,Industrials,Auto Manufacturing,NASDAQ
REFI,Chicago Atlantic Real Estate Finance Inc. Common Stock,$11.96,-0.05,-0.42%,253638447,United States,2021,83802,Real Estate,Real Estate Investment Trusts,NASDAQ
REFR,Research Frontiers Incorporated Common Stock,$0.8696,-0.0084,-0.96%,30217053,United States,,95565,Miscellaneous,Multi-Sector Companies,NASDAQ
REG,Regency Centers Corporation Common Stock,$78.75,0.1,0.13%,14417815309,United States,1993,1784648,Real Estate,Real Estate Investment Trusts,NASDAQ
REGCO,Regency Centers Corporation 5.875% Series B Cumulative Redeemable Preferred Stock,$22.12,0.06,0.27%,4049804122,United States,,991,Real Estate,Real Estate Investment Trusts,NASDAQ
REGCP,Regency Centers Corporation 6.25% Series A Cumulative Redeemable Preferred Stock,$23.1718,-0.0622,-0.27%,4242371210,United States,,4200,Real Estate,Real Estate Investment Trusts,NASDAQ
REGN,Regeneron Pharmaceuticals Inc. Common Stock,$709.21,7.79,1.11%,74352889885,United States,1991,554272,Health Care,Biotechnology: Pharmaceutical Preparations,NASDAQ
REKR,Rekor Systems Inc. Common Stock,$0.8506,-0.0229,-2.62%,116173397,United States,,43583973,Telecommunications,Telecommunications Equipment,NASDAQ
RELL,Richardson Electronics Ltd. Common Stock,$14.59,0.11,0.76%,212385492,United States,1983,75080,Technology,Electronic Components,NASDAQ
RELY,Remitly Global Inc. Common Stock,$23.78,0.99,4.34%,5002283349,United States,2021,4104635,Real Estate,Real Estate,NASDAQ
RENT,Rent the Runway Inc. Class A Common Stock,$4.76,-0.18,-3.64%,159076406,United States,2021,41190,Consumer Discretionary,Other Specialty Stores,NASDAQ
RENX,RenX Enterprises Corp. Common Stock,$2.57,-0.14,-5.17%,6444370,United States,,359450,Finance,Real Estate,NASDAQ
REPL,Replimune Group Inc. Common Stock,$3.03,0.53,21.20%,250195036,United States,2018,6779441,Health Care,Biotechnology: Biological Products (No Diagnostic Substances),NASDAQ
RETO,ReTo Eco-Solutions Inc. Class A Shares,$0.6133,-0.0137,-2.19%,8634774,China,2017,142337,Industrials,Industrial Machinery/Components,NASDAQ
REVB,Revelation Biosciences Inc. Common Stock,$1.08,-0.04,-3.57%,4018054,United States,2020,72727,Health Care,Biotechnology: Pharmaceutical Preparations,NASDAQ
REVBW,Revelation Biosciences Inc. Warrant,$0.0084,0.0004,5.00%,31252,United States,2020,1010,Health Care,Biotechnology: Pharmaceutical Preparations,NASDAQ
REYN,Reynolds Consumer Products Inc. Common Stock,$20.70,-0.07,-0.34%,4362228783,United States,2020,1273633,Consumer Discretionary,Containers/Packaging,NASDAQ
RFAI,RF Acquisition Corp II Ordinary Shares,$10.92,0,0.00%,0,Singapore,2024,3015,,,NASDAQ
RFAIR,RF Acquisition Corp II Right,$0.10,0,0.00%,0,Singapore,2024,200,Technology,Computer Software: Prepackaged Software,NASDAQ
RFAIU,RF Acquisition Corp II Unit,$10.84,0,0.00%,0,Singapore,2024,10,Technology,Computer Software: Prepackaged Software,NASDAQ
RFAM,RF Acquisition Corp III Ordinary Shares,$9.85,0.01,0.10%,0,Singapore,2026,153,,,NASDAQ
RFAMR,RF Acquisition Corp III Rights,$0.115,0,0.00%,0,Singapore,2026,50,,,NASDAQ
RFAMU,RF Acquisition Corp III Units,$9.93,0,0.00%,0,Singapore,2026,10,Finance,Blank Checks,NASDAQ
RFIL,RF Industries Ltd. Common Stock,$13.94,-0.8,-5.43%,150750882,United States,,167258,Technology,Electrical Products,NASDAQ
RGC,Regencell Bioscience Holdings Limited Ordinary Shares,$27.36,-1.76,-6.04%,13529216523,Hong Kong,2021,66037,Health Care, Medicinal Chemicals and Botanical Products ,NASDAQ
RGCO,RGC Resources Inc. Common Stock,$22.85,-1.55,-6.35%,237514028,United States,,16129,Utilities,Oil & Gas Production,NASDAQ
RGEN,Repligen Corporation Common Stock,$118.21,1.01,0.86%,6666958180,United States,1986,1290884,Health Care,Biotechnology: Biological Products (No Diagnostic Substances),NASDAQ
RGLD,Royal Gold Inc. Common Stock,$228.42,-2.17,-0.94%,19378947679,United States,,583468,Industrials,Precious Metals,NASDAQ
RGNX,REGENXBIO Inc. Common Stock,$9.39,0.27,2.96%,484685818,United States,2015,678112,Health Care,Biotechnology: Biological Products (No Diagnostic Substances),NASDAQ
RGP,Resources Connection Inc. Common Stock,$4.21,-0.18,-4.10%,144526538,United States,,346067,Real Estate,Real Estate,NASDAQ
RGS,Regis Corporation Common Stock,$26.59,-0.405,-1.50%,66442507,United States,1991,3514,Consumer Discretionary,Other Consumer Services,NASDAQ
RGTI,Rigetti Computing Inc. Common Stock,$17.70,0.2,1.14%,5882516200,United States,,27828826,Technology,EDP Services,NASDAQ
RGTIW,Rigetti Computing Inc. Warrants,$7.7499,0.2699,3.61%,2575644762,United States,,140807,Technology,EDP Services,NASDAQ
RIBB,Ribbon Acquisition Corp Class A Ordinary Shares,$10.63,0,0.00%,0,Japan,2025,24,,,NASDAQ
RIBBU,Ribbon Acquisition Corp Unit,$10.48,0,0.00%,0,Japan,2025,3,,,NASDAQ
RICK,RCI Hospitality Holdings Inc. Common Stock,$25.00,-0.35,-1.38%,192750000,United States,1995,39195,Consumer Discretionary,Restaurants,NASDAQ
RIGL,Rigel Pharmaceuticals Inc. Common Stock,$29.54,0.14,0.48%,545899761,United States,2000,253597,Health Care,Biotechnology: Pharmaceutical Preparations,NASDAQ
RILY,BRC Group Holdings Inc. Common Stock,$8.61,-0.37,-4.12%,302649525,United States,,683280,Finance,Investment Managers,NASDAQ
RILYG,BRC Group Holdings Inc. 5.00% Senior Notes due 2026,$23.93,0.03,0.13%,729794789,United States,,31976,Finance,Investment Managers,NASDAQ
RILYL,BRC Group Holdings Inc. Depositary Shares each representing 1/1000th in a share of 7.375% Series B Cumulative Perpetual Preferred Stock par value $0.0001,$14.40,0.385,2.75%,506173421,United States,,15285,Finance,Investment Managers,NASDAQ
RILYN,BRC Group Holdings Inc. 6.50% Senior Notes Due 2026,$24.75,0.0361,0.15%,754802384,United States,,47437,Finance,Investment Managers,NASDAQ
RILYP,BRC Group Holdings Inc. Depositary Shares each representing a 1/1000th fractional interest in a share of Series A Cumulative Perpetual Preferred Stock,$14.00,0.5,3.70%,492113048,United States,,20580,Finance,Investment Managers,NASDAQ
RILYT,BRC Group Holdings Inc. 6.00% Senior Notes Due 2028,$20.12,-0.13,-0.64%,613600968,United States,,29572,Finance,Investment Managers,NASDAQ
RILYZ,BRC Group Holdings Inc. 5.25% Senior Notes due 2028,$18.48,-0.15,-0.81%,563585780,United States,,26801,Finance,Investment Managers,NASDAQ
RIME,Algorhythm Holdings Inc. Common Stock,$0.94,-0.08,-7.84%,13772565,United States,,682780,Consumer Staples,Diversified Electronic Products,NASDAQ
RIOT,Riot Platforms Inc. Common Stock ,$18.68,0.18,0.97%,7057569387,United States,,18823249,Finance,Finance: Consumer Services,NASDAQ
RITR,Reitar Logtech Holdings Limited Ordinary shares,$0.4952,-0.0248,-4.77%,30922145,Hong Kong,2024,22260,Finance,Real Estate,NASDAQ
RIVN,Rivian Automotive Inc. Class A Common Stock,$14.51,-0.51,-3.40%,18288662191,United States,2021,48844494,Industrials,Auto Manufacturing,NASDAQ
RJET,Republic Airways Holdings Inc. Common Stock,$18.70,0.42,2.30%,875711201,United States,2018,98241,Consumer Discretionary,Air Freight/Delivery Services,NASDAQ
RKDA,Arcadia Biosciences Inc. Common Stock,$1.20,0.08,7.14%,2468261,United States,2015,32417,Consumer Staples,Farming/Seeds/Milling,NASDAQ
RKLB,Rocket Lab Corporation Common Stock,$80.31,1.5,1.90%,46239871863,United States,2020,16241322,Industrials,Military/Government/Technical,NASDAQ
RLAY,Relay Therapeutics Inc. Common Stock,$13.09,0.37,2.91%,2504634984,United States,2020,3506368,Health Care,Biotechnology: Biological Products (No Diagnostic Substances),NASDAQ
RLMD,Relmada Therapeutics Inc. Common Stock,$7.41,-0.23,-3.01%,777221732,United States,,731907,Health Care,Biotechnology: Pharmaceutical Preparations,NASDAQ
RLYB,Rallybio Corporation Common Stock,$14.12,4.71,50.05%,74690211,United States,2021,10663894,Health Care,Biotechnology: Pharmaceutical Preparations,NASDAQ
RMBI,Richmond Mutual Bancorporation Inc. Common Stock,$15.15,-0.34,-2.20%,159094089,United States,2019,31181,Finance,Major Banks,NASDAQ
