symbol,company_name,last_price,net_change,percent_change,market_cap,country,ipo_year,volume,sector,industry,exchange
DCBG,Dime Community Bancshares Inc. 9.000% Fixed-to-Floating Rate Subordinated Notes due 2034,$26.56,0.06,0.23%,1039787799,United States,,116,Finance,Major Banks,NYSE
DCH,Dauch Corporation Common Stock,$5.36,-0.35,-6.13%,1269308386,United States,,3040454,Consumer Discretionary,Auto Parts:O.E.M.,NYSE
DCI,Donaldson Company Inc. Common Stock,$85.18,-1.04,-1.21%,9865057219,United States,,492664,Industrials,Pollution Control Equipment,NYSE
DCO,Ducommun Incorporated Common Stock,$137.01,-4.23,-3.00%,2053361608,United States,,248763,Industrials,Military/Government/Technical,NYSE
DCOM,Dime Community Bancshares Inc. Common Stock,$35.52,-0.55,-1.53%,1566911200,United States,,188019,Finance,Major Banks,NYSE
DCOM^,Dime Community Bancshares Inc. Fixed-Rate Non-Cumulative Perpetual Preferred Stock Series A,$19.35,0.08,0.42%,,United States,,5948,,,NYSE
DD,DuPont de Nemours Inc. Common Stock,$45.41,-0.83,-1.80%,18611482492,United States,2017,3654151,Industrials,Major Chemicals,NYSE
DDD,3D Systems Corporation Common Stock,$2.34,-0.03,-1.27%,341778011,United States,,1856265,Technology,Computer Software: Prepackaged Software,NYSE
DDL,Dingdong (Cayman) Limited American Depositary Shares (each two representing three Ordinary Shares),$2.53,-0.06,-2.32%,597656043,Cayman Islands,2021,197944,Consumer Discretionary,Catalog/Specialty Distribution,NYSE
DDS,Dillard's Inc. Common Stock,$550.79,-14.73,-2.61%,8601726536,United States,,68001,Consumer Discretionary,Department/Specialty Retail Stores,NYSE
DDT,Dillard's Capital Trust I,$26.08,0.0299,0.12%,407293212,United States,,21078,Consumer Discretionary,Department/Specialty Retail Stores,NYSE
DE,Deere & Company Common Stock,$578.39,1.13,0.20%,1.56227E+11,United States,,799301,Industrials,Industrial Machinery/Components,NYSE
DEA,Easterly Government Properties Inc. Common Stock,$22.99,-0.57,-2.42%,1067871108,United States,2015,471329,Real Estate,Real Estate Investment Trusts,NYSE
DEC,Diversified Energy Company Common Stock,$16.82,0.37,2.25%,1291040815,United States,2025,553045,,,NYSE
DECK,Deckers Outdoor Corporation Common Stock,$97.65,-3.23,-3.20%,13861414668,United States,1993,1792031,Consumer Discretionary,Shoe Manufacturing,NYSE
DEI,Douglas Emmett Inc. Common Stock,$11.09,0.15,1.37%,1857411611,United States,2006,2229310,Real Estate,Real Estate Investment Trusts,NYSE
DELL,Dell Technologies Inc. Class C Common Stock ,$211.64,1.47,0.70%,1.36666E+11,United States,2018,3844564,Technology,Computer Manufacturing,NYSE
DEO,Diageo plc Common Stock,$78.51,-1.19,-1.49%,43698912914,United Kingdom,,982143,Consumer Staples,Beverages (Production/Distribution),NYSE
DFH,Dream Finders Homes Inc. Class A Common Stock,$14.04,-1.22,-8.00%,1285157465,United States,2022,741160,Consumer Discretionary,Homebuilding,NYSE
DFIN,Donnelley Financial Solutions Inc. Common Stock ,$50.63,-0.17,-0.34%,1444479216,United States,2016,229797,Consumer Discretionary,Other Consumer Services,NYSE
DFP,Flaherty & Crumrine Dynamic Preferred and Income Fund Inc. Common Stock,$21.03,-0.19,-0.90%,0,,2013,48458,Finance,Investment Managers,NYSE
DG,Dollar General Corporation Common Stock,$114.48,0.05,0.04%,25211509114,United States,2009,3379430,Consumer Discretionary,Department/Specialty Retail Stores,NYSE
DGX,Quest Diagnostics Incorporated Common Stock,$191.50,-1.17,-0.61%,21198366154,United States,,567813,Health Care,Medical Specialities,NYSE
DHF,BNY Mellon High Yield Strategies Fund Common Stock,$2.42,-0.02,-0.82%,0,United States,1998,588997,Finance,Finance Companies,NYSE
DHI,D.R. Horton Inc. Common Stock,$143.53,-6.45,-4.30%,40702181854,United States,,2270884,Consumer Discretionary,Homebuilding,NYSE
DHR,Danaher Corporation Common Stock,$174.04,-1.11,-0.63%,1.2318E+11,United States,,4532245,Industrials,Industrial Machinery/Components,NYSE
DHT,DHT Holdings Inc.,$18.59,-0.28,-1.48%,2993764032,Jersey,2005,1960571,Consumer Discretionary,Marine Transportation,NYSE
DHX,DHI Group Inc. Common Stock,$2.48,-0.05,-1.98%,108868317,United States,2007,168208,Real Estate,Real Estate,NYSE
DIN,Dine Brands Global Inc. Common Stock,$26.68,-0.26,-0.97%,346314884,United States,,603462,Consumer Discretionary,Restaurants,NYSE
DINO,HF Sinclair Corporation Common Stock,$71.79,2.62,3.79%,12941973622,United States,1960,3966152,Energy,Natural Gas Distribution,NYSE
DIS,Walt Disney Company (The) Common Stock,$101.31,-1.77,-1.72%,1.79473E+11,United States,,8400077,Consumer Discretionary,Services-Misc. Amusement & Recreation,NYSE
DK,Delek US Holdings Inc. Common Stock,$48.04,1.31,2.80%,2944253518,United States,2017,1187937,Energy,Integrated oil Companies,NYSE
DKL,Delek Logistics Partners L.P. Common Units representing Limited Partner Interests,$51.16,-2.79,-5.17%,2720085317,United States,2012,49225,Energy,Natural Gas Distribution,NYSE
DKS,Dick's Sporting Goods Inc Common Stock,$217.27,-7.35,-3.27%,19434562720,United States,2002,892633,Consumer Discretionary,Other Specialty Stores,NYSE
DLB,Dolby Laboratories Common Stock,$58.41,0.95,1.65%,5525475897,United States,2005,1135774,Miscellaneous,Multi-Sector Companies,NYSE
DLNG,Dynagas LNG Partners LP Common Units,$3.86,-0.05,-1.28%,140434562,Greece,,47075,Consumer Discretionary,Marine Transportation,NYSE
DLNG^A,Dynagas LNG Partners LP 9.00% Series A Cumulative Redeemable Preferred Units,$26.73,0.25,0.94%,,Greece,,9499,,,NYSE
DLR,Digital Realty Trust Inc. Common Stock,$198.51,-2.19,-1.09%,69757618956,United States,2004,1700255,Real Estate,Real Estate Investment Trusts,NYSE
DLR^J,Digital Realty Trust Inc. 5.250% Series J Cumulative Redeemable Preferred Stock,$20.52,-0.01,-0.05%,,United States,,23697,,,NYSE
DLR^K,Digital Realty Trust Inc. 5.850% Series K Cumulative Redeemable Preferred Stock par value $0.01 per share,$22.935,-0.0343,-0.15%,,United States,,5208,,,NYSE
DLR^L,Digital Realty Trust Inc. 5.200% Series L Cumulative Redeemable Preferred Stock,$20.0301,-0.1199,-0.60%,,United States,,15237,,,NYSE
DLX,Deluxe Corporation Common Stock,$31.18,-0.72,-2.26%,1412222301,United States,,355286,Consumer Discretionary,Publishing,NYSE
DLY,DoubleLine Yield Opportunities Fund Common Shares of Beneficial Interest,$14.22,-0.05,-0.35%,681788977,United States,2020,146258,Finance,Investment Managers,NYSE
DMA,Destra Multi-Alternative Fund Common Stock,$7.54,0,0.00%,0,,2022,11148,Finance,Trusts Except Educational Religious and Charitable,NYSE
DMB,BNY Mellon Municipal Bond Infrastructure Fund Inc. Common Stock,$10.75,-0.06,-0.56%,0,,2013,86531,Finance,Trusts Except Educational Religious and Charitable,NYSE
DMO,Western Asset Mortgage Opportunity Fund Inc. Common Stock,$11.07,-0.02,-0.18%,0,United States,2010,71352,Finance,Trusts Except Educational Religious and Charitable,NYSE
DNA,Ginkgo Bioworks Holdings Inc. Class A Common Stock,$9.91,0.21,2.17%,615762280,United States,2021,2178403,Health Care,Biotechnology: Biological Products (No Diagnostic Substances),NYSE
DNOW,DNOW Inc. Common Stock,$13.42,0.01,0.08%,2495053271,United States,2014,2860288,Consumer Discretionary,Oil and Gas Field Machinery,NYSE
DNP,DNP Select Income Fund Inc. Common Stock,$10.60,-0.1,-0.94%,0,United States,1987,640778,Finance,Investment Managers,NYSE
DOC,Healthpeak Properties Inc. Common Stock,$16.29,-0.13,-0.79%,11325730991,United States,,9035541,Real Estate,Real Estate Investment Trusts,NYSE
DOCN,DigitalOcean Holdings Inc. Common Stock,$108.81,5.99,5.83%,11354698024,United States,2021,5151057,Technology,Computer Software: Programming Data Processing,NYSE
DOCS,Doximity Inc. Class A Common Stock,$24.89,-0.09,-0.36%,4597405965,United States,2021,3219575,Technology,EDP Services,NYSE
DOLE,Dole plc Ordinary Shares,$15.18,0.04,0.26%,1444599311,Ireland,2021,765332,Consumer Staples,Farming/Seeds/Milling,NYSE
DOUG,Douglas Elliman Inc. Common Stock,$1.90,-0.06,-3.06%,172721556,United States,2021,364238,Finance,Real Estate,NYSE
DOV,Dover Corporation Common Stock,$220.86,-4.93,-2.18%,29741319896,United States,,1076647,Industrials,Industrial Machinery/Components,NYSE
DOW,Dow Inc. Common Stock ,$40.58,0.29,0.72%,29247687554,United States,2019,8787388,Industrials,Major Chemicals,NYSE
DPG,Duff & Phelps Utility and Infrastructure Fund Inc.,$14.88,-0.13,-0.87%,0,United States,2011,92466,Finance,Trusts Except Educational Religious and Charitable,NYSE
DQ,DAQO New Energy Corp. American Depositary Shares each representing five ordinary shares,$19.95,0.81,4.23%,1349939433,China,2010,936720,Technology,Semiconductors,NYSE
DRD,DRDGOLD Limited American Depositary Shares,$26.72,-0.06,-0.22%,2310181033,South Africa,,198185,Basic Materials,Precious Metals,NYSE
DRI,Darden Restaurants Inc. Common Stock,$192.09,-2.67,-1.37%,22001028726,United States,,974884,Consumer Discretionary,Restaurants,NYSE
DSL,DoubleLine Income Solutions Fund Common Shares of Beneficial Interests,$11.09,-0.06,-0.54%,1131144823,United States,2013,322853,Finance,Trusts Except Educational Religious and Charitable,NYSE
DSM,BNY Mellon Strategic Municipal Bond Fund Inc. Common Stock,$5.97,-0.07,-1.16%,0,United States,1989,122364,Finance,Investment Managers,NYSE
DSU,Blackrock Debt Strategies Fund Inc. Common Stock,$9.89,-0.11,-1.10%,0,United States,1998,679436,Finance,Finance Companies,NYSE
DSX,Diana Shipping inc. common stock,$2.59,0.03,1.17%,319967971,Greece,2005,682162,Consumer Discretionary,Marine Transportation,NYSE
DSX^B,Diana Shipping Inc. Perpetual Preferred Shares Series B (Marshall Islands),$26.858,-0.132,-0.49%,,Greece,,557,,,NYSE
DT,Dynatrace Inc. Common Stock,$38.75,1.14,3.03%,11557230668,United States,2019,4337822,Technology,Computer Software: Prepackaged Software,NYSE
DTB,DTE Energy Company 2020 Series G 4.375% Junior Subordinated Debentures due 2080,$17.0021,-0.1078,-0.63%,3536918180,United States,2020,12667,Utilities,Electric Utilities: Central,NYSE
DTE,DTE Energy Company Common Stock,$146.73,-2.06,-1.39%,30523994366,United States,,2137714,Utilities,Electric Utilities: Central,NYSE
DTF,DTF Tax-Free Income 2028 Term Fund Inc. Common Stock,$11.37,-0.0501,-0.44%,79926177,United States,1991,2365,Finance,Investment Managers,NYSE
DTG,DTE Energy Company 2021 Series E 4.375% Junior Subordinated Debentures,$17.16,-0.03,-0.18%,3569765851,United States,2021,29989,Utilities,Electric Utilities: Central,NYSE
DTK,DTE Energy Company 2025 Series H 6.25% Junior Subordinated Debentures due 2085,$24.67,-0.02,-0.08%,0,United States,2025,42247,Utilities,Electric Utilities: Central,NYSE
DTM,DT Midstream Inc. Common Stock ,$146.97,-0.49,-0.33%,14993014922,United States,2021,825727,Utilities,Natural Gas Distribution,NYSE
DTW,DTE Energy Company 2017 Series E 5.25% Junior Subordinated Debentures due 2077,$21.72,0.01,0.05%,4518374958,United States,2017,14409,Utilities,Electric Utilities: Central,NYSE
DUK,Duke Energy Corporation (Holding Company) Common Stock,$127.45,-1.15,-0.89%,99171091306,United States,,3365787,Utilities,Power Generation,NYSE
DUK^A,Duke Energy Corporation Depositary Shares each representing a 1/1000th interest in a share of 5.75% Series A Cumulative Redeemable Perpetual Preferred Stock,$24.96,0.01,0.04%,,United States,,61157,,,NYSE
DUKB,Duke Energy Corporation 5.625% Junior Subordinated Debentures due 2078,$23.95,-0.11,-0.46%,18635917119,United States,2018,27790,Utilities,Power Generation,NYSE
DV,DoubleVerify Holdings Inc. Common Stock,$11.40,0.09,0.80%,1792567840,United States,2021,2387477,Technology,Computer Software: Programming Data Processing,NYSE
DVA,DaVita Inc. Common Stock,$154.08,2.43,1.60%,10160704215,United States,,875887,Health Care,Misc Health and Biotechnology Services,NYSE
DVN,Devon Energy Corporation Common Stock,$51.26,0.7,1.38%,31855792937,United States,1985,11095724,Energy,Oil & Gas Production,NYSE
DX,Dynex Capital Inc. Common Stock,$13.26,-0.31,-2.28%,2852901027,United States,,5145253,Real Estate,Real Estate Investment Trusts,NYSE
DX^C,Dynex Capital Inc. 6.900% Series C Fixed-to-Floating Rate Cumulative Redeemable Preferred Stock,$25.685,-0.165,-0.64%,,United States,,5693,,,NYSE
DXC,DXC Technology Company Common Stock ,$11.49,-0.39,-3.28%,1950541975,United States,,3700396,Technology,EDP Services,NYSE
DXYZ,Destiny Tech100 Inc. Common Stock,$38.53,3.82,11.01%,0,,2024,4716138,,,NYSE
DY,Dycom Industries Inc. Common Stock,$429.47,-4.13,-0.95%,12892087713,United States,,421643,Industrials,Water Sewer Pipeline Comm & Power Line Construction,NYSE
E,ENI S.p.A. Common Stock,$56.19,0.03,0.05%,88408365878,Italy,,500629,Energy,Oil & Gas Production,NYSE
EAF,GrafTech International Ltd. Common Stock,$9.23,0.69,8.08%,240421517,United States,2018,572690,Energy,Industrial Machinery/Components,NYSE
EAI,Entergy Arkansas LLC First Mortgage Bonds 4.875% Series Due September 1 2066,$20.70,0.07,0.34%,9477123849,United States,2016,22969,Utilities,Electric Utilities: Central,NYSE
EARN,Ellington Credit Company Common Shares of Beneficial Interest,$4.72,-0.06,-1.26%,177279400,United States,2013,585295,Real Estate,Real Estate Investment Trusts,NYSE
EAT,Brinker International Inc. Common Stock,$140.18,-7.96,-5.37%,6012010402,United States,,1306274,Consumer Discretionary,Restaurants,NYSE
EBF,Ennis Inc. Common Stock,$20.50,-0.62,-2.94%,518503753,United States,,608608,Consumer Discretionary,Office Equipment/Supplies/Services,NYSE
EBS,Emergent BioSolutions Inc. Common Stock,$8.54,0.07,0.83%,440632368,United States,2006,839212,Health Care,Biotechnology: Pharmaceutical Preparations,NYSE
EC,Ecopetrol S.A. American Depositary Shares,$14.03,0.11,0.79%,28843361332,Colombia,,4238744,Energy,Oil & Gas Production,NYSE
ECAT,BlackRock ESG Capital Allocation Term Trust Common Shares of Beneficial Interest,$14.88,0.05,0.34%,1609048800,United States,2021,412482,Finance,Trusts Except Educational Religious and Charitable,NYSE
ECC           ,Eagle Point Credit Company Inc. Common Stock,$4.25,0.03,0.71%,257815727,United States,2014,1390148,Finance,Trusts Except Educational Religious and Charitable,NYSE
ECC^D,Eagle Point Credit Company Inc. 6.75% Series D Preferred Stock,$18.70,-0.05,-0.27%,,United States,,13258,,,NYSE
ECCC,Eagle Point Credit Company Inc. 6.50% Series C Term Preferred Stock due 2031,$24.26,-0.37,-1.50%,1471672832,United States,,11136,Finance,Trusts Except Educational Religious and Charitable,NYSE
ECCU,Eagle Point Credit Company Inc. 7.75% Notes due 2030,$25.25,-0.095,-0.38%,0,United States,2024,3382,,,NYSE
ECCV,Eagle Point Credit Company Inc. 5.375% Notes due 2029,$23.905,-0.055,-0.23%,1450137636,United States,2022,6887,Finance,Trusts Except Educational Religious and Charitable,NYSE
ECCW,Eagle Point Credit Company Inc. 6.75% Notes due 2031,$25.16,0.02,0.08%,1526269104,United States,2021,1165,Finance,Trusts Except Educational Religious and Charitable,NYSE
ECCX,Eagle Point Credit Company Inc. 6.6875% Notes due 2028,$25.16,0.01,0.04%,1526269104,United States,2022,3912,Finance,Trusts Except Educational Religious and Charitable,NYSE
ECG,Everus Construction Group Inc. Common Stock,$150.93,1.79,1.20%,7703709594,United States,2024,681924,Consumer Discretionary,Homebuilding,NYSE
ECL,Ecolab Inc. Common Stock,$255.59,-3.92,-1.51%,72184690863,United States,,1726045,Consumer Discretionary,Package Goods/Cosmetics,NYSE
ECO,Okeanis Eco Tankers Corp. Common Stock,$55.39,0.28,0.51%,2162683440,,,209826,Consumer Discretionary,Marine Transportation,NYSE
ECVT,Ecovyst Inc. Common Stock,$14.12,-0.24,-1.67%,1545438321,United States,2017,1405554,Industrials,Major Chemicals,NYSE
ED,Consolidated Edison Inc. Common Stock,$109.63,-0.86,-0.78%,40390021199,United States,,2909904,Utilities,Power Generation,NYSE
EDD,Morgan Stanley Emerging Markets Domestic Debt Fund Inc. Common Stock,$5.51,-0.14,-2.48%,0,United States,2007,455169,Finance,Finance Companies,NYSE
EDF,Virtus Stone Harbor Emerging Markets Income Fund Common Shares of Beneficial Interest,$5.19,-0.02,-0.38%,0,United States,2010,107390,Finance,Investment Managers,NYSE
EDN,Empresa Distribuidora Y Comercializadora Norte S.A. (Edenor) American Depositary Shares,$24.33,0.58,2.44%,1100760292,Argentina,2007,124076,Utilities,Electric Utilities: Central,NYSE
EDU,New Oriental Education & Technology Group Inc. Sponsored ADR representing 10 Ordinary Share (Cayman Islands),$53.14,-0.68,-1.26%,21142512516,China,2006,500757,Real Estate,Other Consumer Services,NYSE
EE,Excelerate Energy Inc. Class A Common Stock,$34.38,-0.09,-0.26%,3922595348,United States,2022,226033,Utilities,Oil/Gas Transmission,NYSE
EEA,The European Equity Fund Inc. Common Stock,$10.45,-0.17,-1.60%,0,United States,,49738,Finance,Trusts Except Educational Religious and Charitable,NYSE
EEX,Emerald Holding Inc. Common Stock,$4.64,-0.2,-4.13%,918298841,United States,2017,28073,Real Estate,Real Estate,NYSE
EFC,Ellington Financial Inc. Common Stock ,$13.01,-0.23,-1.74%,1621683789,United States,2010,1274137,Finance,Real Estate,NYSE
EFC^B,Ellington Financial Inc. 6.250% Series B Fixed-Rate Reset Cumulative Redeemable Preferred Stock,$24.53,0.06,0.25%,,United States,,5918,,,NYSE
EFC^C,Ellington Financial Inc. 8.625% Series C Fixed-Rate Reset Cumulative Redeemable Preferred Stock,$25.475,-0.0749,-0.29%,,United States,,4434,,,NYSE
EFC^D,Ellington Financial Inc. 7.00% Series D Cumulative Perpetual Redeemable Preferred Stock,$23.05,0,0.00%,,United States,,343,,,NYSE
EFOR,Everforth Inc. Common Stock,$20.74,-0.44,-2.08%,853549059,United States,,2060081,Consumer Discretionary,Professional Services,NYSE
EFR,Eaton Vance Senior Floating-Rate Fund Common Shares of Beneficial Interest,$10.53,-0.09,-0.85%,0,United States,2003,94199,Finance,Trusts Except Educational Religious and Charitable,NYSE
EFT,Eaton Vance Floating Rate Income Trust Common Shares of Beneficial Interest,$10.89,-0.07,-0.64%,316794619,United States,2004,134889,Finance,Finance Companies,NYSE
EFX,Equifax Inc. Common Stock,$172.24,-1.61,-0.93%,20509031726,United States,,4101135,Finance,Finance: Consumer Services,NYSE
EFXT,Enerflex Ltd Common Shares,$27.43,0.27,0.99%,3347109488,Canada,2022,828577,Industrials,Industrial Machinery/Components,NYSE
EG,Everest Group Ltd. Common Stock,$347.52,-6.05,-1.71%,17285684765,Bermuda,,370282,Finance,Property-Casualty Insurers,NYSE
EGP,EastGroup Properties Inc. Common Stock,$198.34,-1.84,-0.92%,10661812120,United States,,318006,Real Estate,Real Estate Investment Trusts,NYSE
EGY,VAALCO Energy Inc.  Common Stock,$6.67,0.19,2.93%,713771067,United States,,1137796,Energy,Oil & Gas Production,NYSE
EHAB,Enhabit Inc. Common Stock,$13.74,-0.01,-0.07%,696937386,United States,2022,433408,Health Care,Medical/Nursing Services,NYSE
EHC,Encompass Health Corporation Common Stock,$106.64,-0.84,-0.78%,10578589891,United States,,1212203,Health Care,Hospital/Nursing Management,NYSE
EHI,Western Asset Global High Income Fund Inc Common Stock,$6.095,-0.025,-0.41%,0,United States,2003,84081,Finance,Investment Managers,NYSE
EIC,Eagle Point Income Company Inc. Common Stock,$10.28,0.01,0.10%,91575350,United States,2019,130180,Finance,Finance/Investors Services,NYSE
EICA,Eagle Point Income Company Inc. 5.00% Series A Term Preferred Stock due 2026,$24.93,0,0.00%,222079132,United States,2021,2580,Finance,Finance/Investors Services,NYSE
EIG,Employers Holdings Inc Common Stock,$41.50,-0.42,-1.00%,757081222,United States,2007,266863,Finance,Property-Casualty Insurers,NYSE
EIIA,Eagle Point Institutional Income Fund 8.125% Series A Term Preferred Shares Due 2029,$25.256,0.006,0.02%,0,,2024,1721,,,NYSE
EIX,Edison International Common Stock,$69.00,-0.88,-1.26%,26550781929,United States,,2673321,Utilities,Electric Utilities: Central,NYSE
EL,Estee Lauder Companies Inc. (The) Common Stock,$81.33,2.03,2.56%,29424780437,United States,1995,5333606,Consumer Discretionary,Package Goods/Cosmetics,NYSE
ELAN,Elanco Animal Health Incorporated Common Stock,$22.51,0,0.00%,11241031172,United States,2018,6236051,Health Care,Biotechnology: Pharmaceutical Preparations,NYSE
ELC,Entergy Louisiana Inc. Collateral Trust Mortgage Bonds 4.875 % Series due September 1 2066,$20.475,-0.055,-0.27%,4366038877,United States,2016,13858,Utilities,Electric Utilities: Central,NYSE
ELF,e.l.f. Beauty Inc. Common Stock,$61.85,1.36,2.25%,3652380982,United States,2016,2663467,Consumer Discretionary,Package Goods/Cosmetics,NYSE
ELLA,Ellington Credit Company 8.50% Notes due 2031,$25.60,0.06,0.24%,0,United States,2026,3489,Real Estate,Real Estate Investment Trusts,NYSE
ELME,Elme Communities Common Stock,$2.18,0.03,1.40%,193710185,United States,2000,975101,Real Estate,Real Estate Investment Trusts,NYSE
ELPC,Companhia Paranaense de Energia (COPEL) American Depositary Shares (each representing four (4) Common Shares),$12.69,0.05,0.40%,9462966603,Brazil,2023,254033,Utilities,Electric Utilities: Central,NYSE
ELS,Equity Lifestyle Properties Inc. Common Stock,$62.63,-0.19,-0.30%,12146308944,United States,,909376,Real Estate,Real Estate Investment Trusts,NYSE
ELV,Elevance Health Inc. Common Stock,$371.90,-0.78,-0.21%,80762689122,United States,,1052297,Health Care,Medical Specialities,NYSE
EMA,Emera Incorporated Common Shares,$52.54,-0.45,-0.85%,16065844652,Canada,2025,295934,Utilities,Electric Utilities: Central,NYSE
EMBJ,Embraer S.A. Common Stock,$63.62,1.01,1.61%,11495595457,Brazil,,1273110,Industrials,Aerospace,NYSE
EMD,Western Asset Emerging Markets Debt Fund Inc Common Stock,$10.86,-0.08,-0.73%,0,United States,,174229,Finance,Finance/Investors Services,NYSE
EME,EMCOR Group Inc. Common Stock,$910.26,6.76,0.75%,40452207452,United States,,315277,Industrials,Engineering & Construction,NYSE
EMF,Templeton Emerging Markets Fund Common Stock,$20.73,0.03,0.15%,0,United States,1987,19747,Finance,Finance/Investors Services,NYSE
EMN,Eastman Chemical Company Common Stock,$76.72,-0.81,-1.05%,8772928931,United States,,1499830,Industrials,Major Chemicals,NYSE
EMO,ClearBridge Energy Midstream Opportunity Fund Inc. Common Stock,$51.41,-0.09,-0.18%,0,United States,2011,75619,Finance,Investment Managers,NYSE
EMP,Entergy Mississippi LLC First Mortgage Bonds 4.90% Series Due October 1 2066,$20.99,-0.06,-0.29%,9609895149,United States,2016,8233,Utilities,Electric Utilities: Central,NYSE
EMR,Emerson Electric Company Common Stock,$135.46,-1.99,-1.45%,76128520000,United States,,3317010,Technology,Consumer Electronics/Appliances,NYSE
ENB,Enbridge Inc Common Stock,$54.72,-0.11,-0.20%,1.19417E+11,Canada,,4617034,Energy,Natural Gas Distribution,NYSE
ENIC,Enel Chile S.A. American Depositary Shares (Each representing 50 shares of Common Stock),$4.44,-0.03,-0.67%,6141990279,Chile,2016,1120778,Utilities,Electric Utilities: Central,NYSE
ENJ,Entergy New Orleans LLC First Mortgage Bonds 5.0% Series due December 1 2052,$20.38,0.18,0.89%,9330617587,United States,,305,Utilities,Power Generation,NYSE
ENO,Entergy New Orleans LLC First Mortgage Bonds 5.50% Series due April 1 2066,$22.0086,-0.0814,-0.37%,4706117557,United States,2016,6628,Utilities,Power Generation,NYSE
ENOV,Enovis Corporation Common Stock,$23.34,-0.28,-1.19%,1337396681,United States,,892438,Health Care,Industrial Specialties,NYSE
ENR,Energizer Holdings Inc. Common Stock,$19.34,-0.34,-1.73%,1324185838,United States,2015,1768195,Miscellaneous,Industrial Machinery/Components,NYSE
ENS,EnerSys Common Stock,$211.17,-1.22,-0.57%,7781904648,United States,2004,311857,Technology,Industrial Machinery/Components,NYSE
ENVA,Enova International Inc. Common Stock,$163.91,-7.02,-4.11%,4078883303,United States,2014,691417,Finance,Finance: Consumer Services,NYSE
EOD,Allspring Global Dividend Opportunity Fund Common Shares of Beneficial Interest,$6.38,-0.01,-0.16%,0,United States,2007,141320,Finance,Investment Managers,NYSE
EOG,EOG Resources Inc. Common Stock,$141.61,2.66,1.91%,75862716421,United States,,3331892,Energy,Oil & Gas Production,NYSE
EOI,Eaton Vance Enhance Equity Income Fund Eaton Vance Enhanced Equity Income Fund Shares of Beneficial Interest,$19.78,-0.15,-0.75%,0,United States,2004,79381,Finance,Finance/Investors Services,NYSE
EOS,Eaton Vance Enhance Equity Income Fund II Common Stock,$22.33,-0.16,-0.71%,0,,2005,165495,Finance,Trusts Except Educational Religious and Charitable,NYSE
EOT,Eaton Vance Municipal Income Trust EATON VANCE NATIONAL MUNICIPAL OPPORTUNITIES TRUST,$16.96,-0.12,-0.70%,264998660,United States,2009,26656,Finance,Investment Bankers/Brokers/Service,NYSE
EP^C,El Paso Corporation Preferred Stock,$50.51,-0.22,-0.43%,,United States,,489,,,NYSE
EPAC,Enerpac Tool Group Corp. Common Stock,$34.67,-0.27,-0.77%,1787001669,United States,,361993,Technology,Industrial Machinery/Components,NYSE
EPAM,EPAM Systems Inc. Common Stock,$110.60,-1.73,-1.54%,5800340907,United States,2012,1455642,Technology,EDP Services,NYSE
EPC,Edgewell Personal Care Company Common Stock,$21.56,-1,-4.43%,1007210004,United States,,721872,Consumer Discretionary,Package Goods/Cosmetics,NYSE
EPD,Enterprise Products Partners L.P. Common Stock,$38.67,0.64,1.68%,83595285612,United States,,5422578,Utilities,Natural Gas Distribution,NYSE
EPR,EPR Properties Common Stock,$55.25,-0.03,-0.05%,4226821690,United States,1997,793811,Real Estate,Real Estate Investment Trusts,NYSE
EPR^C,EPR Properties 5.75% Series C Cumulative Convertible Preferred Shares,$24.65,-0.18,-0.73%,,United States,,12592,,,NYSE
EPR^E,EPR Properties Series E Cumulative Conv Pfd Shs Ser E,$31.97,-0.44,-1.36%,,United States,,937,,,NYSE
EPR^G,EPR Properties 5.750% Series G Cumulative Redeemable Preferred Shares,$20.03,0.27,1.37%,,United States,,16639,,,NYSE
EPRT,Essential Properties Realty Trust Inc. Common Stock,$31.02,-0.24,-0.77%,6707949524,United States,2018,1136129,Real Estate,Real Estate Investment Trusts,NYSE
EQBK,Equity Bancshares Inc. Class A Common Stock,$45.50,-0.44,-0.96%,955142325,United States,,81835,Finance,Major Banks,NYSE
EQH,Equitable Holdings Inc. Common Stock,$41.49,-0.68,-1.61%,11631631923,United States,2018,4243878,Finance,Specialty Insurers,NYSE
