symbol,company_name,last_price,net_change,percent_change,market_cap,country,ipo_year,volume,sector,industry,exchange
PNFP^C,Pinnacle Financial Partners Inc. Fixed-to-Floating Rate Non-Cumulative Perpetual Preferred Stock Series C,$25.1543,0.0443,0.18%,,United States,,4517,,,NYSE
PNI,Pimco New York Municipal Income Fund II Common Shares of Beneficial Interest,$7.00,0.01,0.14%,0,United States,2002,40907,Finance,Trusts Except Educational Religious and Charitable,NYSE
PNNT,PennantPark Investment Corporation Common Stock,$4.82,0.05,1.05%,314727173,United States,2022,473131,Finance,Finance: Consumer Services,NYSE
PNR,Pentair plc. Ordinary Share,$77.08,-2.02,-2.55%,12456555100,Switzerland,,2346647,Industrials,Industrial Machinery/Components,NYSE
PNW,Pinnacle West Capital Corporation Common Stock,$101.82,-1.72,-1.66%,12322831887,United States,,1763950,Utilities,Electric Utilities: Central,NYSE
POR,Portland General Electric Co Common Stock,$49.01,-0.72,-1.45%,5671927839,United States,,1744061,Utilities,Electric Utilities: Central,NYSE
POST,Post Holdings Inc. Common Stock,$103.84,0.44,0.43%,4966066901,United States,2012,752188,Consumer Staples,Packaged Foods,NYSE
PPG,PPG Industries Inc. Common Stock,$104.08,-3.43,-3.19%,23199432000,United States,,2237860,Consumer Discretionary,Paints/Coatings,NYSE
PPL,PPL Corporation Common Stock,$37.80,0.2,0.53%,28431840667,United States,,10933531,Utilities,Electric Utilities: Central,NYSE
PPLC,PPL Corporation Corporate Units,$49.74,0.26,0.53%,37412691925,United States,,26537,Utilities,Electric Utilities: Central,NYSE
PPT,Putnam Premier Income Trust Common Stock,$3.49,-0.02,-0.57%,347353638,United States,1988,90551,Finance,Finance Companies,NYSE
PR,Permian Resources Corporation Class A Common Stock,$22.52,0.42,1.90%,18970069866,United States,2022,15560194,Energy,Oil & Gas Production,NYSE
PRA,ProAssurance Corporation Common Stock,$24.65,-0.01,-0.04%,1267346300,United States,,806043,Finance,Property-Casualty Insurers,NYSE
PRG,PROG Holdings Inc. Common Stock,$35.89,-0.3,-0.83%,1437953092,United States,,608262,Consumer Discretionary,Diversified Commercial Services,NYSE
PRGO,Perrigo Company plc Ordinary Shares,$11.39,-0.53,-4.45%,1567826119,United States,,1736270,Health Care,Biotechnology: Pharmaceutical Preparations,NYSE
PRH,Prudential Financial Inc. 5.950% Junior Subordinated Notes due 2062,$23.87,-0.09,-0.38%,8402240000,United States,2022,27773,Finance,Life Insurance,NYSE
PRI,Primerica Inc. Common Stock,$270.61,-6.35,-2.29%,8496364360,United States,2010,260172,Finance,Life Insurance,NYSE
PRIF^D,Priority Income Fund Inc. 7.00% Series D Term Preferred Stock due 2029,$25.06,-0.18,-0.71%,,,,106,,,NYSE
PRIF^K,Priority Income Fund Inc. 7.000% Series K Cumulative Preferred Stock,$22.10,-0.13,-0.59%,,,,1208,,,NYSE
PRIF^L,Priority Income Fund Inc. 6.375% Series L Term Preferred Stock Due 2029,$24.49,-0.0041,-0.02%,,,,4144,,,NYSE
PRIM,Primoris Services Corporation Common Stock,$185.55,5.2,2.88%,10062660020,United States,,1282793,Industrials,Water Sewer Pipeline Comm & Power Line Construction,NYSE
PRKS,United Parks & Resorts Inc. Common Stock,$33.85,-1.42,-4.03%,1618230697,United States,2013,616644,Health Care,Biotechnology: Electromedical & Electrotherapeutic Apparatus,NYSE
PRLB,Proto Labs Inc. Common stock,$64.34,-0.83,-1.27%,1530908855,United States,2012,222448,Industrials,Metal Fabrications,NYSE
PRM,Perimeter Solutions SA Common Stock,$29.74,-0.73,-2.40%,4851398854,Luxembourg,,971938,Industrials,Major Chemicals,NYSE
PRMB,Primo Brands Corporation Class A Common Stock,$20.09,0.06,0.30%,7296224443,United States,2024,4498893,Consumer Staples,Beverages (Production/Distribution),NYSE
PRS,Prudential Financial Inc. 5.625% Junior Subordinated Notes due 2058,$22.88,-0.08,-0.35%,8053760000,United States,2018,28681,Finance,Life Insurance,NYSE
PRSU,Pursuit Attractions and Hospitality Inc. Common Stock,$40.07,-2.15,-5.09%,1099892008,United States,,170061,Real Estate,Real Estate,NYSE
PRT,PermRock Royalty Trust Units of Beneficial Interest,$2.82,0.01,0.36%,34307364,United States,2018,179200,Energy,Oil & Gas Production,NYSE
PRU,Prudential Financial Inc. Common Stock,$97.65,-0.97,-0.98%,33964496348,United States,2001,2064458,Finance,Life Insurance,NYSE
PS,Pershing Square Inc. Common Stock,$34.21,-3.78,-9.95%,13684000000,,2026,2208831,Finance,Investment Managers,NYSE
PSA,Public Storage Common Stock,$295.36,-6.19,-2.05%,51849192129,United States,,581036,Real Estate,Real Estate Investment Trusts,NYSE
PSA^F,Public Storage Depositary Shares Each Representing 1/1000 of a 5.15% Cumulative Preferred Share of Beneficial Interest Series F par value $0.01 per share,$20.4901,-0.1449,-0.70%,,United States,,8307,,,NYSE
PSA^G,Public Storage Depositary Shares Each Representing 1/1000 of a 5.05% Cumulative Preferred Share of Beneficial Interest Series G,$20.27,-0.13,-0.64%,,United States,,15289,,,NYSE
PSA^H,Public Storage Depositary Shares Each Representing 1/1000 of a  5.60% Cumulative Preferred  Share of Beneficial Interest Series H,$22.355,-0.095,-0.42%,,United States,,13951,,,NYSE
PSA^I,Public Storage Depositary Shares Each Representing 1/1000 of a 4.875% Cumulative Preferred Share of Beneficial Interest Series I par value $0.01 per share,$19.1965,-0.0935,-0.49%,,United States,,16188,,,NYSE
PSA^J,Public Storage Depositary Shares Each Representing 1/1000 of a 4.700% Cumulative Preferred Share of Beneficial Interest Series J par value $0.01 per share,$18.5088,-0.0362,-0.20%,,United States,,11035,,,NYSE
PSA^K,Public Storage Depositary Shares Each Representing 1/1000 of a 4.75% Cumulative Preferred Share of Beneficial Interest Series K,$18.75,-0.05,-0.27%,,United States,,10408,,,NYSE
PSA^L,Public Storage Depositary Shares Each Representing 1/1000 of a 4.625% Cumulative Preferred Share of Beneficial Interest Series L par value $0.01 per share,$18.28,-0.13,-0.71%,,United States,,26361,,,NYSE
PSA^M,Public Storage Depositary Shares Each Representing 1/1000 of a 4.125% Cumulative Preferred Share of Beneficial Interest Series M,$16.18,-0.08,-0.49%,,United States,,10225,,,NYSE
PSA^N,Public Storage Depositary Shares Each Representing 1/1000 of a 3.875% Cumulative Preferred Share of Beneficial Interest Series N,$15.20,0,0.00%,,United States,,8899,,,NYSE
PSA^O,Public Storage Depositary Shares Each Representing 1/1000 of a 3.900% Cumulative Preferred Share of Beneficial Interest Series O,$15.26,-0.05,-0.33%,,United States,,11686,,,NYSE
PSA^P,Public Storage Depositary Shares Each Representing 1/1000 of a 4.000% Cumulative Preferred Share of Bene cial Interest Series P,$15.87,0.01,0.06%,,United States,,48888,,,NYSE
PSA^Q,Public Storage Depositary Shares Each Representing 1/1000 of a 3.950% Cumulative Preferred Share of Beneficial Interest Series Q par value $0.01 per share,$15.53,0.005,0.03%,,United States,,8172,,,NYSE
PSA^R,Public Storage Depositary Shares Each Representing 1/1000 of a 4.00% Cumulative Preferred Share of Bene cial Interest Series R,$15.77,0.02,0.13%,,United States,,19362,,,NYSE
PSA^S,Public Storage Depositary Shares Each Representing 1/1000 of a 4.100% Cumulative Preferred Share of Beneficial Interest Series S,$16.161,0.021,0.13%,,United States,,6340,,,NYSE
PSBD,Palmer Square Capital BDC Inc. Common Stock,$11.16,0.04,0.36%,0,,2024,114598,,,NYSE
PSEC^A,Prospect Capital Corporation 5.35% Series A Fixed Rate Cumulative Perpetual Preferred Stock,$18.00,0.14,0.78%,,United States,,8854,,,NYSE
PSF,Cohen & Steers Select Preferred and Income Fund Inc. Common Stock,$19.83,-0.19,-0.95%,974418993,,2010,60597,Finance,Investment Managers,NYSE
PSFE,Paysafe Limited Common Shares,$9.09,-0.32,-3.40%,578818321,,2021,280328,Real Estate,Real Estate,NYSE
PSN,Parsons Corporation Common Stock,$50.02,-0.85,-1.67%,5351065620,United States,2019,1295961,Technology,EDP Services,NYSE
PSO,Pearson Plc Common Stock,$14.89,-0.19,-1.26%,9466659047,United Kingdom,,673467,Consumer Discretionary,Books,NYSE
PSQH,PSQ Holdings Inc. Class A Common Stock,$0.8053,0.049,6.48%,39231989,,2021,480370,Consumer Discretionary,Advertising,NYSE
PSTL,Postal Realty Trust Inc. Class A Common Stock,$21.84,-0.33,-1.49%,600000361,United States,2019,318132,Real Estate,Real Estate Investment Trusts,NYSE
PSUS,Pershing Square USA Ltd. Common Shares,$42.51,-0.29,-0.68%,1111636500,,2026,2357240,,,NYSE
PSX,Phillips 66 Common Stock,$178.47,2.28,1.29%,71554873019,United States,,2368941,Energy,Integrated oil Companies,NYSE
PTA,Cohen & Steers Tax-Advantaged Preferred Securities and Income Fund Common Shares of Beneficial Interest,$19.66,-0.1,-0.51%,1086676165,United States,2020,129708,Finance,Trusts Except Educational Religious and Charitable,NYSE
PTY,Pimco Corporate & Income Opportunity Fund,$12.26,-0.01,-0.08%,0,United States,2002,948646,Finance,Investment Managers,NYSE
PUK,Prudential Public Limited Company Common Stock,$29.23,-0.94,-3.12%,37344817430,United Kingdom,,963313,Finance,Life Insurance,NYSE
PUMP,ProPetro Holding Corp. Common Stock,$16.85,0.23,1.38%,2066096046,United States,2017,15830405,Energy,Oilfield Services/Equipment,NYSE
PVH,PVH Corp. Common Stock,$88.36,-3.28,-3.58%,4047906614,United States,,803029,Industrials,Garments and Clothing,NYSE
PVL,Permianville Royalty Trust Units of Beneficial Interest,$1.92,0.04,2.13%,63360000,United States,2011,188377,Energy,Oil & Gas Production,NYSE
PWR,Quanta Services Inc. Common Stock,$757.34,15.13,2.04%,1.13647E+11,United States,,1316197,Industrials,Engineering & Construction,NYSE
PXED,Phoenix Education Partners Inc. Common Stock,$28.74,-1.22,-4.07%,1029207479,,2025,47369,Real Estate,Other Consumer Services,NYSE
PYT,PPlus Tr GSC-2 Tr Ctf Fltg Rate,$23.27,0.15,0.65%,0,United States,,500,Finance,Finance: Consumer Services,NYSE
Q,Qnity Electronics Inc. Common Stock,$141.06,-2.27,-1.58%,29563696871,United States,2025,1196091,Technology,Semiconductors,NYSE
QBTS,D-Wave Quantum Inc. Common Shares,$20.92,0.43,2.10%,7682876778,United States,2022,24790262,Technology,EDP Services,NYSE
QGEN,Qiagen N.V. Common Shares,$33.96,-0.29,-0.85%,6998298612,Netherlands,2026,1467858,Health Care,Biotechnology: Biological Products (No Diagnostic Substances),NYSE
QSR,Restaurant Brands International Inc. Common Shares,$80.05,0.02,0.03%,36553698832,Canada,2014,2960918,Consumer Discretionary,Restaurants,NYSE
QTWO,Q2 Holdings Inc. Common Stock,$53.53,2.3,4.49%,3351000643,United States,2014,1071957,Technology,Computer Software: Prepackaged Software,NYSE
QUAD,Quad Graphics Inc Class A Common Stock,$7.96,-0.47,-5.58%,410413803,United States,,554515,Consumer Discretionary,Publishing,NYSE
QXO,QXO Inc. Common Stock,$19.12,-0.7,-3.53%,13862956038,United States,,12641737,Consumer Discretionary,RETAIL: Building Materials,NYSE
QXO^B,QXO Inc.  Depositary Shares each representing a 1/20th interest in a share of 5.50% Series B Mandatory Convertible Preferred Stock,$53.66,-1.41,-2.56%,,United States,,130857,,,NYSE
R,Ryder System Inc. Common Stock,$232.97,-17.02,-6.81%,9013846463,United States,,585866,Consumer Discretionary,Rental/Leasing Companies,NYSE
RA,Brookfield Real Assets Income Fund Inc. Common Stock,$12.92,-0.08,-0.62%,0,United States,2016,200288,Finance,Investment Managers,NYSE
RAC,Rithm Acquisition Corp. Class A Ordinary Shares,$10.41,0,0.00%,0,,2025,9,,,NYSE
RACE,Ferrari N.V. Common Shares,$338.91,-2.35,-0.69%,79286142018,Italy,2015,840670,Industrials,Auto Manufacturing,NYSE
RAL,Ralliant Corporation Common Stock,$45.55,-0.14,-0.31%,5098393508,United States,2025,1168366,Industrials,Industrial Machinery/Components,NYSE
RAMP,LiveRamp Holdings Inc. Common Stock,$30.31,0.1,0.33%,1913315537,United States,2018,393063,Technology,EDP Services,NYSE
RBA,RB Global Inc. Common Stock,$105.01,0.13,0.12%,19499517130,Canada,,1409445,Real Estate,Real Estate,NYSE
RBC,RBC Bearings Incorporated Common Stock,$593.12,-2.64,-0.44%,18753838148,United States,2022,151719,Industrials,Metal Fabrications,NYSE
RBLX,Roblox Corporation Class A Common Stock,$47.57,2.44,5.41%,34059108900,United States,2021,17674467,Technology,Computer Software: Prepackaged Software,NYSE
RBRK,Rubrik Inc. Class A Common Stock,$57.93,2.86,5.19%,11922563799,United States,2024,3283608,Technology,Computer Software: Prepackaged Software,NYSE
RC,Ready Capital Corporation Common Stock,$1.86,-0.08,-4.12%,302954529,United States,2013,967069,Real Estate,Real Estate Investment Trusts,NYSE
RC^C,Ready Capital Corporation 6.25% Series C Cumulative Convertible Preferred Stock,$11.95,0.04,0.34%,,United States,,513,,,NYSE
RC^E,Ready Capital Corporation 6.50% Series E Cumulative Redeemable Preferred Stock,$12.715,0.01,0.08%,,United States,,4049,,,NYSE
RCD,Ready Capital Corporation 9.00% Senior Notes due 2029,$22.27,-0.12,-0.54%,0,United States,2024,5657,Real Estate,Real Estate Investment Trusts,NYSE
RCI,Rogers Communication Inc. Common Stock,$35.90,-0.54,-1.48%,19394051580,Canada,,790973,Telecommunications,Cable & Other Pay Television Services,NYSE
RCL,Royal Caribbean Cruises Ltd. Common Stock,$259.48,-6.07,-2.29%,69591232891,United States,1993,3080750,Consumer Discretionary,Marine Transportation,NYSE
RCS,PIMCO Strategic Income Fund Inc.,$5.46,0.03,0.55%,0,United States,1994,191846,Finance,Investment Managers,NYSE
RCUS,Arcus Biosciences Inc. Common Stock,$26.05,0.37,1.44%,3272627166,United States,2018,1223784,Health Care,Biotechnology: Pharmaceutical Preparations,NYSE
RDDT,Reddit Inc. Class A Common Stock,$169.07,2.59,1.56%,32535010641,United States,2024,6091961,Technology,EDP Services,NYSE
RDN,Radian Group Inc. Common Stock,$35.46,0.03,0.09%,4780953683,United States,,1209180,Finance,Property-Casualty Insurers,NYSE
RDW,Redwire Corporation Common Stock,$8.64,-0.7,-7.50%,1718657810,United States,2021,22718113,Industrials,Military/Government/Technical,NYSE
RDY,Dr. Reddy's Laboratories Ltd Common Stock,$13.35,-0.37,-2.70%,11139979123,India,,2509111,Health Care,Biotechnology: Pharmaceutical Preparations,NYSE
RELX,RELX PLC PLC American Depositary Shares (Each representing One Ordinary Share),$36.36,0.01,0.03%,66319821718,United Kingdom,2015,1485710,Real Estate,Real Estate,NYSE
RERE,ATRenew Inc. American Depositary Shares (every three of which representing two Class A ordinary shares),$4.32,-0.11,-2.48%,947224783,Cayman Islands,2021,510169,Consumer Discretionary,Other Specialty Stores,NYSE
RES,RPC Inc. Common Stock,$7.76,0.14,1.84%,1719920735,United States,,1571952,Energy,Oilfield Services/Equipment,NYSE
REX,REX American Resources Corporation,$51.16,1.19,2.38%,1685093653,United States,,171656,Industrials,Major Chemicals,NYSE
REXR,Rexford Industrial Realty Inc. Common Stock,$35.14,-0.37,-1.04%,7931734702,United States,2013,1838530,Real Estate,Real Estate Investment Trusts,NYSE
REXR^B,Rexford Industrial Realty Inc. 5.875% Series B Cumulative Redeemable Preferred Stock,$21.685,0.035,0.16%,,United States,,2097,,,NYSE
REXR^C,Rexford Industrial Realty Inc. 5.625% Series C Cumulative Redeemable Preferred Stock par value $0.01 per share,$20.715,-0.085,-0.41%,,United States,,2562,,,NYSE
REZI,Resideo Technologies Inc. Common Stock ,$39.47,-0.67,-1.67%,5976595672,United States,2018,942618,Industrials,Wholesale Distributors,NYSE
RF,Regions Financial Corporation Common Stock,$27.66,-0.53,-1.88%,23981686265,United States,,6269572,Finance,Major Banks,NYSE
RF^C,Regions Financial Corporation Depositary Shares each Representing a 1/40th Interest in a  Share of 5.700% Fixed-to-Floating Rate Non-Cumulative  Perpetual Preferred Stock Series C,$24.55,0.04,0.16%,,United States,,21809,,,NYSE
RF^E,Regions Financial Corporation Depositary Shares Each Representing a 1/40th Interest in a Share of 4.45% Non-Cumulative Perpetual Preferred Stock Series E,$16.71,-0.0601,-0.36%,,United States,,20635,,,NYSE
RF^F,Regions Financial Corporation Depositary Shares Each Representing a 1/40th Interest in a Share of Non-Cumulative Perpetual Preferred Stock Series F,$25.68,0,0.00%,,United States,,25720,,,NYSE
RFI,Cohen & Steers Total Return Realty Fund Inc. Common Stock,$11.56,-0.07,-0.60%,568042540,United States,1993,77557,Finance,Investment Managers,NYSE
RFL,Rafael Holdings Inc. Class B Common Stock,$1.25,0.01,0.81%,65015175,United States,2018,101332,Finance,Real Estate,NYSE
RFM,RiverNorth Flexible Municipal Income Fund Inc. Common Stock,$14.22,-0.17,-1.18%,86951020,,2020,9230,Finance,Finance/Investors Services,NYSE
RFMZ,RiverNorth Flexible Municipal Income Fund II Inc. Common Stock,$12.94,-0.08,-0.61%,315111723,,2021,58102,Finance,Trusts Except Educational Religious and Charitable,NYSE
RGA,Reinsurance Group of America Incorporated Common Stock,$211.16,2.48,1.19%,13832929851,United States,,435039,Finance,Life Insurance,NYSE
RGR,Sturm Ruger & Company Inc. Common Stock,$40.99,-2.17,-5.03%,653556857,United States,,150407,Industrials,Ordnance And Accessories,NYSE
RGT,Royce Global Trust Inc. Common Stock,$14.18,-0.19,-1.32%,88865252,,2013,4871,Finance,Trusts Except Educational Religious and Charitable,NYSE
RH,RH Common Stock,$122.35,-7.62,-5.86%,2304410374,United States,2012,1074653,Consumer Discretionary,Other Specialty Stores,NYSE
RHI,Robert Half Inc. Common Stock,$26.37,-0.65,-2.41%,2697481942,United States,,1862658,Consumer Discretionary,Professional Services,NYSE
RHLD,Resolute Holdings Management Common Stock ,$137.02,-1.36,-0.98%,1131434703,United States,,111661,Finance,Finance: Consumer Services,NYSE
RHP,Ryman Hospitality Properties Inc. (REIT),$105.40,-0.82,-0.77%,6651717269,United States,,653103,Real Estate,Real Estate Investment Trusts,NYSE
RIG,Transocean Ltd (Switzerland) Common Stock,$6.88,0.04,0.59%,7614444314,Switzerland,,34334014,Energy,Oil & Gas Production,NYSE
RIO,Rio Tinto Plc Common Stock,$98.63,-1.95,-1.94%,1.2388E+11,Australia,2002,1672827,Basic Materials,Metal Mining,NYSE
RITM,Rithm Capital Corp. Common Stock,$9.64,-0.15,-1.53%,5382075595,United States,,4241414,Real Estate,Real Estate Investment Trusts,NYSE
RITM^A,Rithm Capital Corp. 7.50% Series A Fixed-to-Floating Rate Cumulative Redeemable Preferred Stock,$25.27,0,0.00%,,United States,,17729,,,NYSE
RITM^B,Rithm Capital Corp. 7.125% Series B Fixed-to-Floating Rate Cumulative Redeemable Preferred Stock,$25.03,-0.07,-0.28%,,United States,,28352,,,NYSE
RITM^C,Rithm Capital Corp. 6.375% Series C Fixed-to-Floating Rate Cumulative Redeemable Preferred Stock,$24.61,-0.09,-0.36%,,United States,,33533,,,NYSE
RITM^D,Rithm Capital Corp. 7.00% Fixed-Rate Reset Series D Cumulative Redeemable Preferred Stock,$24.86,0.04,0.16%,,United States,,35346,,,NYSE
RITM^E,Rithm Capital Corp. 8.75% Series E Fixed-Rate Cumulative Redeemable Preferred Stock,$24.52,-0.05,-0.20%,,United States,,34300,,,NYSE
RITM^F,Rithm Capital Corp. 8.750% Series F Fixed-Rate Reset Cumulative Redeemable Preferred Stock,$24.54,-0.23,-0.93%,,United States,,67988,,,NYSE
RIV,RiverNorth Opportunities Fund Inc. Common Stock,$11.72,-0.09,-0.76%,0,United States,2015,52852,Finance,Finance Companies,NYSE
RIV^A,RiverNorth Opportunities Fund Inc. 6.00% Series A Perpetual Preferred Stock,$22.575,0.055,0.24%,,United States,,5669,,,NYSE
RJF,Raymond James Financial Inc. Common Stock,$156.81,0.61,0.39%,30905845512,United States,,847752,Finance,Investment Bankers/Brokers/Service,NYSE
RKT,Rocket Companies Inc. Class A Common Stock,$14.01,-0.63,-4.30%,39635069250,United States,2020,18900405,Finance,Finance: Consumer Services,NYSE
RL,Ralph Lauren Corporation Common Stock,$354.29,-7.92,-2.19%,21447445762,United States,1997,435412,Industrials,Garments and Clothing,NYSE
RLI,RLI Corp. Common Stock (DE),$50.73,-0.77,-1.50%,4664031532,United States,,915823,Finance,Property-Casualty Insurers,NYSE
RLJ,RLJ Lodging Trust Common Shares of Beneficial Interest $0.01 par value,$8.35,0.05,0.60%,1268511434,United States,2011,6180180,Real Estate,Real Estate Investment Trusts,NYSE
RLJ^A,RLJ Lodging Trust $1.95 Series A Cumulative Convertible  Preferred Shares,$25.21,0.02,0.08%,,United States,,22097,,,NYSE
RLTY,Cohen & Steers Real Estate Opportunities and Income Fund Common Shares of Beneficial Interest,$15.73,-0.01,-0.06%,0,,2022,43548,Finance,Investment Managers,NYSE
RLX,RLX Technology Inc. American Depositary Shares each representing the right to receive one (1) Class A ordinary share,$2.15,-0.04,-1.83%,3330221660,Cayman Islands,2021,1870938,Health Care, Medicinal Chemicals and Botanical Products ,NYSE
RM,Regional Management Corp. Common Stock,$33.88,-1.06,-3.03%,311971953,United States,2012,59887,Finance,Finance: Consumer Services,NYSE
RMAX,RE/MAX Holdings Inc. Class A Common Stock,$10.52,-0.26,-2.41%,211898616,United States,2013,589202,Finance,Real Estate,NYSE
RMD,ResMed Inc. Common Stock,$209.43,4.41,2.15%,30379158501,United States,,2483800,Health Care,Medical/Dental Instruments,NYSE
RMI,RiverNorth Opportunistic Municipal Income Fund Inc. Common Stock,$14.94,-0.23,-1.52%,95216624,,2018,17700,Finance,Finance/Investors Services,NYSE
RMM,RiverNorth Managed Duration Municipal Income Fund Inc. Common Stock,$13.96,-0.205,-1.45%,275565207,,2019,71142,Finance,Trusts Except Educational Religious and Charitable,NYSE
RMMZ,RiverNorth Managed Duration Municipal Income Fund II Inc. Common Stock,$14.845,0.065,0.44%,293034778,,2022,14765,Finance,Investment Managers,NYSE
RMT,Royce Micro-Cap Trust Inc. Common Stock,$13.43,0.05,0.37%,621394107,United States,,175786,Finance,Investment Managers,NYSE
RNG,RingCentral Inc. Class A Common Stock,$47.25,2.17,4.81%,3972428980,United States,2013,1919894,Technology,EDP Services,NYSE
RNGR,Ranger Energy Services Inc. Class A Common Stock,$17.06,-0.09,-0.53%,405373288,United States,2017,271951,Energy,Oilfield Services/Equipment,NYSE
RNP,Cohen & Steers REIT and Preferred and Income Fund Inc. Common Shares,$20.95,-0.13,-0.62%,1029454257,United States,2003,57197,Finance,Investment Managers,NYSE
RNR,RenaissanceRe Holdings Ltd. Common Stock,$302.28,2.98,1.00%,12887115633,Bermuda,,449864,Finance,Property-Casualty Insurers,NYSE
RNR^F,RenaissanceRe Holdings Ltd. Depositary Shares each Representing a 1/1000th Interest in a 5.750% Series F Preference Share,$21.52,-0.13,-0.60%,,Bermuda,,16804,,,NYSE
RNR^G,RenaissanceRe Holdings Ltd. Depositary Shares each representing a 1/1000th interest in a share of 4.20% Series G Preference Shares,$15.53,0.03,0.19%,,Bermuda,,17192,,,NYSE
RNST,Renasant Corporation Common Stock,$39.41,-0.41,-1.03%,3710148319,United States,2023,428362,Finance,Major Banks,NYSE
ROG,Rogers Corporation Common Stock,$135.00,0.56,0.42%,2409552225,United States,1960,259765,Industrials,Major Chemicals,NYSE
ROK,Rockwell Automation Inc. Common Stock,$400.31,-7.12,-1.75%,44977994151,United States,,964751,Industrials,Industrial Machinery/Components,NYSE
ROL,Rollins Inc. Common Stock,$54.15,-0.63,-1.15%,26071257351,United States,,2932551,Consumer Discretionary,Diversified Commercial Services,NYSE
RPC,Ridgepost Capital Inc. Class A Common Stock,$8.03,-0.03,-0.37%,879097002,United States,2021,296439,Finance,Investment Managers,NYSE
RPM,RPM International Inc. Common Stock,$98.22,-3.12,-3.08%,12535477482,United States,,655578,Consumer Discretionary,Paints/Coatings,NYSE
RPT,Rithm Property Trust Inc. Common stock,$14.64,-0.1,-0.68%,113790337,United States,2015,14681,Real Estate,Real Estate Investment Trusts,NYSE
RPT^C,Rithm Property Trust Inc. 9.875% Series C Fixed-to-Floating Rate Cumulative Redeemable Preferred Stock,$24.89,-0.09,-0.36%,,United States,,7410,,,NYSE
RQI,Cohen & Steers Quality Income Realty Fund Inc Common Shares,$13.21,-0.2,-1.49%,1774108390,United States,2002,380012,Finance,Trusts Except Educational Religious and Charitable,NYSE
RRC,Range Resources Corporation Common Stock,$43.00,0.37,0.87%,10131756750,United States,,2953629,Energy,Oil & Gas Production,NYSE
RRX,Regal Rexnord Corporation Common Stock,$212.49,-0.53,-0.25%,14144498633,United States,1976,892510,Consumer Discretionary,Metal Fabrications,NYSE
RS,Reliance Inc. Common Stock,$362.83,-3.02,-0.83%,18521935237,United States,1994,206418,Industrials,Metal Fabrications,NYSE
RSF,RiverNorth Capital and Income Fund Common Stock,$14.565,-0.005,-0.03%,48670069,,2019,11374,Finance,Investment Managers,NYSE
RSG,Republic Services Inc. Common Stock,$206.55,-0.01,-0.01%,63814901458,United States,1998,1627185,Utilities,Environmental Services,NYSE
RSI,Rush Street Interactive Inc. Class A Common Stock,$27.75,-0.58,-2.05%,6457400747,United States,2020,1214262,Consumer Discretionary,Services-Misc. Amusement & Recreation,NYSE
RSKD,Riskified Ltd. Class A Ordinary Shares,$4.84,0.09,1.90%,717312761,,2021,739916,Real Estate,Real Estate,NYSE
RTO,Rentokil Initial plc American Depositary Shares (each representing five (5) Ordinary Shares),$33.48,-0.31,-0.92%,8443656000,United States,2022,471507,Consumer Discretionary,Other Consumer Services,NYSE
RTX,RTX Corporation Common Stock,$172.90,-1.09,-0.63%,2.32842E+11,United States,,5081320,Industrials,Aerospace,NYSE
RVI,Robinhood Ventures Fund I Common Shares of Beneficial Interest,$33.25,0.75,2.31%,0,,2026,597231,,,NYSE
RVLV,Revolve Group Inc. Class A Common Stock,$23.46,-1.52,-6.09%,1678094340,United States,2019,1223888,Consumer Discretionary,Catalog/Specialty Distribution,NYSE
RVT,Royce Small-Cap Trust Inc. Common Stock,$18.34,-0.16,-0.87%,1979926153,United States,1986,150814,Finance,Trusts Except Educational Religious and Charitable,NYSE
RVTY,Revvity Inc. Common Stock,$86.51,-0.17,-0.20%,9672105819,United States,,1573348,Industrials,Biotechnology: Laboratory Analytical Instruments,NYSE
RWT,Redwood Trust Inc. Common Stock,$5.60,-0.13,-2.27%,699971614,United States,1995,1048941,Real Estate,Real Estate Investment Trusts,NYSE
RWT^A,Redwood Trust Inc. 10.00% Series A Fixed-Rate Reset Cumulative Redeemable Preferred Stock,$24.99,0.1,0.40%,,United States,,5986,,,NYSE
RWTN,Redwood Trust Inc. 9.125% Senior Notes Due 2029,$25.3001,-0.1,-0.39%,3269366562,United States,2024,636,Real Estate,Real Estate Investment Trusts,NYSE
